clause_text,clause_type
"Employee Benefit Plans. (a) HUBCO and its Subsidiaries maintain or contribute to certain ""employee pension benefit plans"" (the ""HUBCO Pension Plans""), as such term is defined in Section 3(2)(A) of ERISA, and ""employee welfare benefit plans"" (the ""HUBCO Welfare Plans""), as such term is defined in Section 3(1) of ERISA. Since September 2, 1974, neither HUBCO nor its subsidiaries have contributed to any ""Multiemployer Plan"", as such term is defined in Section 3(37) of ERISA.",employee-benefit-plans
"Employee Benefit Plans. A. Company, each of its Subsidiaries and, with respect to Pension Plans and Multiemployer Plans, each of their respective ERISA Affiliates are in material compliance with all applicable provisions and requirements of ERISA, the regulations and published interpretations thereunder and other applicable law with respect to each Employee Benefit Plan, and have performed all of their material obligations under each Employee Benefit Plan. Company and each of its Subsidiaries are in material compliance with all applicable laws and orders of foreign Government Authorities with respect to each of its pension plans and employee benefit plans for foreign employees, and have performed all of their material obligations under each such pension plan and employee benefit plan. Each Employee Benefit Plan that is intended to qualify under Section 401(a) of the Internal Revenue Code has received, or has timely taken all action necessary to receive, a favorable determination letter from the Internal Revenue Service to such effect and no event has occurred (other than the enactment of legislation for which the remedial amendment period has not expired) that would reasonably be expected to affect adversely such Plan's qualification.",employee-benefit-plans
"Employee Benefit Plans. (a) The SEC Reports disclose or describe each Company Plan that is required to be disclosed or described in such SEC Reports pursuant to the Exchange Act and the Securities Act. The Company and each of its Subsidiaries has no liability under any Plans other than the Company Plans. Except as disclosed in the SEC Reports, neither the Company, its Subsidiaries nor any Commonly Controlled Entity maintains or contributes to, or has within the preceding six years maintained or contributed to, or may have any liability with respect to any Plan subject to Title IV of ERISA or Section 412 of the Code or any ""multiple employer plan"" within the meaning of the Code or ERISA. Each Company Plan (and related trust, insurance contract or fund) has been established and administered in all material respects in accordance with its terms, and complies in form and in operation in all material respects with the applicable requirements of ERISA and the Code and other applicable Requirements of Law.",employee-benefit-plans
"Employee Benefit Plans. (i) Either (a) any Termination Event shall have occurred, (b) a trustee shall be appointed by a United States District Court to administer any Plan or Multiemployer Plan, (c) the PBGC institutes proceedings to terminate any Plan or Multiemployer Plan or to appoint a trustee to administer any Plan, (d) Company or any of its Subsidiaries shall become liable to the PBGC or any other party under Section 4062, 4063 or 4064 of ERISA with respect to any Plan, or (e) Company or any of its Subsidiaries fails to make a deficit reduction contribution required under Code Section 412(l) to any Plan by the due date for such contribution, and, as of the date thereof or any subsequent date, the sum of each of Company’s and its Subsidiaries’ various liabilities (such liabilities to include, without limitation, any liability to the PBGC or to any other party under Section 4062, 4063 or 4064 of ERISA with respect to any Plan, or to any Multiemployer Plan under Section 4201 et seq. of ERISA) as a result of such events listed in subclauses (a) through (e) of this clause (i) exceeds $10,000,000 in the aggregate; or (ii) either (a) a foreign governmental authority has instituted proceedings to terminate a Foreign Pension Plan or a foreign governmental authority has appointed a trustee to administer any Foreign Pension Plan in place of the existing administrator, in each case by reason of a distress termination within the meaning of Section 4041(c) of ERISA, treating such Foreign Pension Plan as if it were subject to ERISA; or (b) any Foreign Pension Plan that is required by applicable law to be funded in a trust or other funding vehicle has failed to comply with such funding requirements, and, as of the date thereof or as of any subsequent date, the sum of each of Company’s and its Subsidiaries’ various liabilities to any Foreign Pension Plan solely as a result of the occurrence of such events listed in subclauses (a) and (c) of this clause (ii) exceeds $10,000,000 in the aggregate;",employee-benefit-plans
"Employee Benefit Plans. (a) Each Employee Benefit Plan and each Guaranteed Pension Plan has been maintained and operated in compliance in all material respects with the provisions of ERISA and, to the extent applicable, the Code, including but not limited to the provisions thereunder respecting prohibited transactions and the bonding of fiduciaries and other persons handling plan funds as required by Section 412 of ERISA. Each Borrower has heretofore delivered to the Agent the most recently completed annual report, Form 5500, with all required attachments, and actuarial statement required to be submitted under Section 103(d) of ERISA, with respect to each Guaranteed Pension Plan.",employee-benefit-plans
"Employee Benefit Plans. (1) Schedule 3.2(m) includes a correct and complete list of, and Horizon has been furnished a true and correct copy of (or an accurate written description thereof in the case of oral agreements or arrangements) (A) all qualified pension and profit-sharing plans, all deferred compensation, consultant, severance, thrift, option, bonus and group insurance contracts and all other incentive, welfare and employee benefit plans, trust, annuity or other funding agreements, and all other agreements (including oral agreements) that are presently in effect, or have been approved prior to the date hereof, maintained for the benefit of employees or former employees of City Holding or its subsidiaries or the dependents or beneficiaries of any employee or former employee of City Holding or its subsidiaries, whether or not subject to ERISA (the ""Employee Plans""), (B) the most recent actuarial and financial reports prepared or required to be prepared with respect to any Employee Plan and (C) the most recent annual reports filed with any governmental agency, the most recent favorable determination letter issued by the Internal Revenue Service, and any open requests for rulings or determination letters, that pertain to any such qualified Employee Plan. Schedule 3.2(m) identifies each Employee Plan that is intended to be qualified under Section 401(a) of the Code and each such plan is qualified.",employee-benefit-plans
"Employee Benefit Plans. (a) Schedule 3.19(a) lists all (i) “employee benefit plans,” within the meaning of Section 3(3) of ERISA, of Radius, (ii) bonus, stock option, stock purchase, stock appreciation right, incentive, deferred compensation, supplemental retirement, severance, and fringe benefit plans, programs, policies or arrangements, and (iii) employment or consulting agreements, for the benefit of, or relating to, any current or former employee (or any beneficiary thereof) of Radius, in the case of a plan described in (i) or (ii) above, that is currently maintained by Radius or with respect to which Radius has an obligation to contribute, and in the case of an agreement described in (iii) above, that is currently in effect (the “Radius Plans”). Radius has heretofore made available to MPMAC true and complete copies of the Radius Plans and any amendments thereto, any related trust, insurance contract, summary plan description, and, to the extent required under ERISA or the Code, the most recent annual report on Form 5500 and summaries of material modifications.",employee-benefit-plans
"Employee Benefit Plans. (a) For purposes of this Section 3.11, the Subsidiaries of the Company shall include any enterprise which, with the Company, forms or formed a controlled group of corporations, a group of trades or business under common control or an affiliated service group, within the meaning of section 414(b), (c) or (m) of the Code.",employee-benefit-plans
"Employee Benefit Plans. (i) All benefit and compensation plans, agreements, programs, policies and arrangements covering current or former employees of PBB (the “PBB Employees”) and current or former directors or independent contractors of PBB including, but not limited to, “employee benefit plans” within the meaning of Section 3(3) of ERISA, and severance, employment, change in control, fringe benefit, deferred compensation, stock option, stock purchase, stock appreciation rights, stock based, incentive and bonus plans, agreements, programs, policies or other arrangements (the “PBB Benefit Plans”), have been Previously Disclosed to Manhattan. True and complete copies of (A) all PBB Benefit Plans including, but not limited to, any trust instruments and insurance contracts forming a part of any PBB Benefit Plans and all amendments thereto; (B) the most recent annual report (Form 5500), together with all schedules, as required, filed with the Internal Revenue Service (“IRS”) or Department of Labor (the “DOL”), as applicable, and any financial statements and opinions required by Section 103(e)(3) of ERISA with respect to each PBB Benefit Plan; (C) for each PBB Benefit Plan which is a “top-hat” plan, a copy of filings with the DOL; (D) the most recent determination letter issued by the IRS (or prototype plan sponsor IRS opinion letter upon which PBB may rely) for each PBB Benefit Plan that is intended to be “qualified” under Section 401(a) of the Code; (E) the most recent summary plan description and any summary of material modifications, as required, for each PBB Benefit Plan; (F) the most recent actuarial report, if any relating to each PBB Benefit Plan; (G) the most recent actuarial valuation, study or estimate of any retiree medical and life insurance benefits plan or supplemental retirement benefits plan; and (H) the most recent summary annual report for each PBB Benefit Plan required to provide summary annual reports by Section 104 of ERISA, have been provided or made available to Manhattan.",employee-benefit-plans
"Employee Benefit Plans. The Company does not maintain and is not required to make contributions to any “pension” and “welfare” benefit plans (within the respective meanings of Sections 4(2) and 4(1) of the Employee Retirement Income Security Act of 1974, as amended).",employee-benefit-plans
"Employee Benefit Plans. (a) Schedule 5.10 hereto sets forth a true and complete list as of the date hereof of all holders of outstanding options under the Target Stock Option Plans, including the number of shares of Target capital stock subject to each such option, the exercise price per share and the term of each such option. On the Closing Date, Target shall deliver to Acquiror an updated Schedule 5.10 hereto current as of such date. At the Effective Time, the Target Stock Option Plans and a portion of each outstanding option to purchase shares of Target Common Stock under the Target Stock Option Plans will be assumed and cashed out by Acquiror on the terms set forth in this paragraph (a) and paragraph (b) below. Each such option so assumed by Acquiror under this Agreement shall continue to have, and be subject to, the same terms and conditions set forth in the Target Stock Option Plans, immediately prior to the Effective Time, except that (i) such option will be exercisable for that number of whole shares of Acquiror Common Stock equal to the product of the number of shares of Target Common Stock that were issuable upon exercise of such option immediately prior to the Effective Time multiplied by the Stock Consideration Exchange Ratio (as defined in Section 1.6(a)(ii) hereof) and rounded down to the nearest whole number of shares of Acquiror Common Stock, (ii) the per share exercise price for the shares of Acquiror Common Stock issuable upon exercise of such assumed option will be equal to the quotient determined by dividing the exercise price per share of Target Common Stock at which such option was exercisable immediately prior to the Effective Time by the Conversion Ratio, rounded up to the nearest whole cent, and (iii) the option shall be fully and immediately exercisable for vested shares of Acquiror Common Stock. While there can be no assurances that the assumed options will be incentive stock options, the parties will use their reasonable efforts to effect the assumption in a manner calculated to ensure preservation of incentive stock option status for the assumed options. Within ten (10) business days after the Effective Time, Acquiror will issue to each person who, immediately prior to the Effective Time, was a holder of an outstanding option under the Target Stock Option Plans a document in form and substance satisfactory to Target evidencing the foregoing assumption of such option by Acquiror. For purposes of this Section 5.10, the Conversion Ratio shall be that fra...",employee-benefit-plans
"Employee Benefit Plans. Except as would not reasonably be expected to result in a Material Adverse Effect, with respect to each employee benefit plan as defined in Section 3(3) of ERISA, the Borrower and its Subsidiaries are in compliance with the applicable provisions of ERISA and the Code and the regulations and published interpretations thereunder. No ERISA Event has occurred or is reasonably expected to occur that, when taken together with all other such ERISA Events, has resulted or could reasonably be expected to result in a Material Adverse Effect. There exists no Unfunded Pension Liability with respect to any Plans that could reasonably be expected to result in a Material Adverse Effect.",employee-benefit-plans
"Employee Benefit Plans. (a) Section 3.16(a) of the Company Disclosure Letter contains a complete and accurate list of all material Employee Plans. With respect to each Employee Plan, to the extent applicable, the Company has made available to Newco complete and accurate copies of (i) the most recent annual report on Form 5500 required to have been filed with the IRS for each Employee Plan, including all schedules thereto; (ii) the most recent determination letter, if any, from the IRS for any Employee Plan that is intended to qualify under Section 401(a) of the Code; (iii) the plan documents and summary plan descriptions, or a written description of the terms of any Employee Plan that is not in writing; (iv) any related trust agreements, insurance contracts, insurance policies or other documents of any funding arrangements; (v) any notices to or from the IRS or any office or representative of the DOL or any similar Governmental Authority relating to any compliance issues in respect of any such Employee Plan; (vi) with respect to each International Employee Plan, to the extent applicable, (A) the most recent annual report or similar compliance documents required to be filed with any Governmental Authority with respect to such plan and (B) any document comparable to the determination letter referenced under clause (ii) above issued by a Governmental Authority relating to the satisfaction of Applicable Law necessary to obtain the most favorable tax treatment and (vii) all other material Contracts relating to each Employee Plan, including administrative service agreements.",employee-benefit-plans
"Employee Benefit Plans. Except as set forth on Exhibit K hereto, the Corporation does not maintain or contribute to, and it has no liability or obligation with respect to any formal or informal stock option, profit sharing, pension, retirement, bonus, stock bonus, thrift-savings, incentive, benefit, welfare, cafeteria, medical insurance, dental insurance, life insurance, accidental death and dismemberment insurance, disability insurance or other similar plan, policy or arrangement (collectively referred to herein as the ""Plans""). The Corporation is not in default under the terms of any of the Plans. The Corporation has made all contributions to each of the Plans required by the terms of the respective Plans, as well as all contributions required to be made in order to satisfy all requirements of law. Each of the Plans has sufficient assets to satisfy (under reasonable and permitted actuarial assumptions) its obligations on a termination basis, and the level of contributions required pursuant to the terms of each Plan is sufficient to satisfy (under reasonable and permitted actuarial assumptions) the obligations of such Plan on a continuing basis for benefits accrued to date.",employee-benefit-plans
"Employee Benefit Plans. Except as could not reasonably be expected, individually or in the aggregate, to have a Material Adverse Effect (i) each employee benefit plan (within the meaning of Section 3(3) of ERISA), established or maintained by the Borrower or any of its Subsidiaries, is in compliance with all applicable Laws and (ii) no ERISA Event has occurred or is reasonably expected to occur.",employee-benefit-plans
"Employee Benefit Plans. During the Term, the Executive (and, where applicable, his spouse and eligible dependents, if any, and their respective designated beneficiaries) shall be eligible to participate in and receive the benefit of each employee benefit plan sponsored or maintained by the Company and generally made available to other senior executives of the Company, subject to the generally applicable provisions thereof. Nothing in this Agreement shall in any way limit the Company’s right to amend or terminate any such plan in its discretion, so long as any such amendment does not impair the rights of the Executive without treating similarly situated executives in a similar fashion.",employee-benefit-plans
"Employee Benefit Plans. (a) Section 3.14(a) of the Company Disclosure Schedule sets forth a complete and accurate list, as of the date of this Agreement, of all Employee Benefit Plans maintained, or contributed to, by the Company, any of the Company’s Subsidiaries or any of their ERISA Affiliates (together, the “Company Employee Plans”). For purposes of this Agreement, the following terms shall have the following meanings: (i) “",employee-benefit-plans
"Employee Benefit Plans. (a) Part 3.12(a) of the Parent Disclosure Schedule sets forth, as of the date of this Agreement, a complete and accurate list of each plan, program, policy, practice, contract, agreement or other arrangement providing for employment, compensation, retirement, pension, deferred compensation, loans, severance, separation, relocation, repatriation, expatriation, visas, work permits, termination pay, performance awards, bonus, incentive, stock option, stock purchase, stock bonus, phantom stock, stock appreciation right, supplemental retirement, profit sharing, fringe benefits, cafeteria benefits, medical benefits, life insurance, disability benefits, accident benefits, salary continuation, accrued leave, vacation, sabbatical, sick pay, sick leave, unemployment benefits or other benefits, whether written or unwritten, including each “voluntary employees’ beneficiary association” under Section 501(c)(9) of the Code and each “employee benefit plan” within the meaning of Section 3(3) of ERISA, in each case, for active, retired or former employees, directors or consultants, which is currently sponsored, maintained, contributed to, or required to be contributed to or with respect to which any potential liability is borne by Parent or any ERISA Affiliate of Parent (collectively, the “Parent Employee Plans”). Neither Parent nor, to the knowledge of Parent, any other person or entity, has made any commitment to modify, change or terminate any Parent Employee Plan, other than with respect to a modification, change or termination required by Legal Requirements. There are no loans by Parent to any of its officers, employees, contractors or directors outstanding on the date hereof, except pursuant to loans under any Parent Employee Plan intended to qualify under Section 401(k) of the Code, and there have never been any loans by Parent subject to Regulation U of the Board of Governors of the Federal Reserve System as from time to time in effect and any successor to all or a portion thereof establishing margin requirements.",employee-benefit-plans
"Employee Benefit Plans. Parent agrees that the employees of the Company will continue to be provided with benefits under employee benefit plans (other than plans involving the potential issuance of or investment in securities of the Company or similar performance-based incentive plans) that in the aggregate are substantially comparable to those currently provided by the Company to such employees. Following the Effective Time, Parent shall cause service by employees of the Company to be taken into account for purpose of eligibility to participate and vesting under any benefit plans of Parent or its subsidiaries (including the Surviving Corporation) which cover such employees, to the same extent such service was counted under a similar plan of the Company. From and after the Effective Time, Parent shall (i) cause to be waived any pre-existing condition limitations and evidence of insurability requirements under benefit plans of Parent or its subsidiaries in which employees of the Company participate, and (ii) cause to be credited any deductibles and out-of-pocket expenses incurred by such employees and their beneficiaries and dependents under the Company's benefit plans during the portion of the calendar year prior to their participation in the benefit plans provided by Parent and its subsidiaries. Parent shall cause the Surviving Corporation to honor all employee benefit obligations to current and former employees under the Company Employee Plans accrued as of the Effective Time and all employee severance plans and all employment or severance agreements set forth in Section 3.11(a) of the Company Disclosure Schedule. Notwithstanding any of the foregoing to the contrary, none of the provisions contained herein shall operate to duplicate any benefit provided to any employee of the Company or the funding of any such benefit or obligate Parent or any affiliate of Parent to (i) make any particular benefit plan or benefit available to any employee, (ii) continue any particular benefit plan or benefit or (iii) refrain from terminating or amending any particular benefit plan or benefit.",employee-benefit-plans
"Employee Benefit Plans. (a) Section 3.11(a) of the Company Disclosure Schedule sets forth a true, complete and correct list of each material employee benefit plan, program, policy, practice, or other arrangement providing benefits to any current or former employee, officer or director of Company or any of its Subsidiaries or any beneficiary or dependent thereof that is sponsored or maintained by Company or any of its Subsidiaries or to which Company or any of its Subsidiaries contributes or is obligated to contribute, whether or not written, including without limitation any employee welfare benefit plan within the meaning of Section 3(1) of the Employee Retirement Income Security Act of 1974, as amended (“ERISA”), any employee pension benefit plan within the meaning of Section 3(2) of ERISA (whether or not such plan is subject to ERISA) and any equity purchase plan, option, equity bonus, phantom equity or other equity plan, profit sharing, bonus, retirement (including compensation, pension, health, medical or life insurance benefits), deferred compensation, excess benefit, incentive compensation, severance, change in control or termination pay, hospitalization or other medical or dental, life or other insurance (including any self-insured arrangements), supplemental unemployment, salary continuation, sick leave or other leave of absence benefits, short- or long-term disability, or vacation benefits plan or any other agreement or policy or other arrangement providing employee benefits, employment-related compensation, fringe benefits or other benefits (whether qualified or nonqualified, funded or unfunded) (whether or not listed in Section 3.11(a) of the Company Disclosure Schedule, each an “Employee Benefit Plan”).",employee-benefit-plans
Employee Benefit Plans. (a) Set forth on Schedule 2.19 hereto is a true and complete list of:,employee-benefit-plans
"Employee Benefit Plans. So long as this Agreement remains in effect, Borrower will maintain each employee benefit plan as to which Borrower may have any liability, in compliance with all applicable requirements of law and regulations.",employee-benefit-plans
"Employee Benefit Plans. There shall occur one or more ERISA Events that individually or in the aggregate would reasonably be expected to result in a Material Adverse Effect during the term of this Agreement; or there shall exist an amount of unfunded benefit liabilities (as defined in Section 4001(a)(18) of ERISA) individually or in the aggregate for all Pension Plans (excluding for purposes of such computation any Pension Plans with respect to which assets exceed benefit liabilities), which would reasonably be expected to result in a Material Adverse Effect; or",employee-benefit-plans
