clause_text,clause_type
"Employee Benefit Plans. Subject to Section 7.10, each of the WPL Benefit Plans, the IES Benefit Plans and the Interstate Benefit Plans in effect at the date hereof shall be maintained in effect with respect to the employees or former employees of WPL and any of its Subsidiaries, IES and any of its Subsidiaries, and Interstate and any of its Subsidiaries, respectively, who are covered by any such Benefit Plan immediately prior to the Closing Date (the ""Affiliated Employees"") until the Company otherwise determines after the Effective Time; provided, however, that nothing herein contained shall limit any reserved right contained in any such WPL Benefit Plan, IES Benefit Plan or Interstate Benefit Plan, to amend, modify, suspend, revoke or terminate any such plan; provided, further, however, that the Company or its Subsidiaries shall provide to the Affiliated Employees for a period of not less than one year following the Effective Time benefits, other than with respect to plans referred to in Section 8.11, which are no less favorable in the aggregate than those provided under the WPL Benefit Plans, the IES Benefit Plans or the Interstate Benefit Plans, as the case may be. Without limitation of the foregoing, each participant of any such WPL Benefit Plan, IES Benefit Plan or Interstate Benefit Plan shall receive credit for purposes of eligibility to participate, vesting, benefit accrual and eligibility to receive benefits under a benefit plan of the Company or any of its Subsidiaries or Affiliates for service credited for the corresponding purpose under such benefit plan; provided, however, that such crediting of service shall not operate to duplicate any benefit to any such participant or the funding for any such benefit. Any person hired by the Company or any of its Subsidiaries after the Closing Date who was not employed by any party hereto or its Subsidiaries immediately prior to the Closing Date shall be eligible to participate in such benefit plans maintained, or contributed to, by the Company or the Subsidiary, division or operation by which such person is employed, provided that such person meets the eligibility requirements of the applicable plan.",employee-benefit-plans
"Employee Benefit Plans. With respect to any Plan, each of the Borrower and each of its ERISA Affiliates is in compliance in all material respects with the applicable provisions of ERISA and the Internal Revenue Code and the regulations and published interpretations thereunder. No ERISA Event has occurred or is reasonably expected to occur that, when taken together with all other such ERISA Events, could reasonably be expected to result in a Material Adverse Effect. Neither the Borrower nor any Subsidiary has (a) failed to comply with any requirement of applicable law relating to any employee pension benefit plan primarily for the benefit of employees of the Borrower or any Subsidiary residing outside the United States that is not subject to ERISA or the Internal Revenue Code or (b) incurred any other liability with respect to such plan (other than liabilities incurred in the ordinary course of business) , except for any such noncompliance or incurrence which could not reasonably be expected to result in a Material Adverse Effect.",employee-benefit-plans
"Employee Benefit Plans. Borrower shall not directly or indirectly, engage in any ""prohibited transaction"" (as defined in section 406 of ERISA or section 4975 of the Code), and Borrower and its ERISA Affiliates shall not, directly or indirectly, (a) incur any ""accumulated funding deficiency"" as such term is defined in section 302 of ERISA with respect to any Employee Plan, (b) permit any Employee Plan to be subject to involuntary termination proceedings pursuant to Title IV of ERISA, or (c) fully or partially withdraw from any Multiemployer Plan, if such prohibited transaction, accumulated funding deficiency, termination proceeding, or withdrawal would result in liability on the part of Borrower in excess of $100,000,000.",employee-benefit-plans
"Employee Benefit Plans. Schedule 3.1(w) lists each pension, retirement , profit sharing, deferred compensation, bonus or other incentive plan, or other employee benefit program, arrangement, agreement or understanding, or medical, vision, dental or other health plan, or life insurance or disability plan, or any other employee benefit plan, including, without limitation, any ""employee benefit plan"" as defined in Section 3(3) of the Employee Retirement Income Security Act of 1974, as amended (""ERISA""), to which MTI contributes or is a party or is bound or under which it may have liability and under which employees or former employees of the Fuel Cell Business (or their beneficiaries) are eligible to participate or derive a benefit (""Employee Benefit Plans'). MTI has delivered to the Company true, correct and complete copies of all Employee Benefit Plans. (x)",employee-benefit-plans
"Employee Benefit Plans. (a) Neither the Company nor any of its subsidiaries has at any time ever maintained, established, sponsored, participated in, or contributed to, any employee compensation, incentive, fringe or benefit plans, programs, policies, commitments or other arrangements (whether or not set forth in a written document and including, without limitation, all “employee benefit plans” (within the meaning of Section 3(3) of the Employee Retirement Income Security Act of 1974, as amended (“ERISA”)) covering (i) any active or former employee, director or consultant of the Company, (ii) any subsidiary of the Company, or (iii) any trade or business (whether or not incorporated) which is a member of a controlled group or which is under common control with the Company within the meaning of Section 414 of the Internal Revenue Code of 1986, as amended (the “Code”), or with respect to which the Company or any of its subsidiaries has or, to Seller’s knowledge, may in the future have liability.",employee-benefit-plans
"Employee Benefit Plans. The DP Disclosure Schedule identifies each salary, bonus, material deferred compensation, material incentive compensation, stock purchase, stock option, severance pay, termination pay, hospitalization, medical, insurance, supplemental unemployment benefits, profit-sharing, pension or retirement plan, program or material agreement.",employee-benefit-plans
"Employee Benefit Plans. During the term of this Agreement, Executive shall be entitled to participate in and receive the benefits of any pension or other retirement benefit plan, profit sharing, stock option, employee stock ownership, or other plans, benefits and privileges given to employees and executives of Bancorp and Bank, to the extent commensurate with his then existing duties and responsibilities, as fixed by the Boards of Directors of Bancorp and Bank, including without limitation enrollment in Bank's Supplemental Executive Retirement Program (SERP). Bancorp and Bank shall not make any changes in such plans, benefits or privileges which would adversely affect Executive's rights or benefits thereunder, unless such change occurs pursuant to a program applicable to all executive officers of Bancorp and Bank and does not result in a proportionately greater adverse change in the rights of or benefits to Executive as compared with any other executive officer of Bancorp and Bank. Nothing paid to Executive under any plan or arrangement presently in effect or made available in the future shall be deemed to be in lieu of the salary payable to Executive pursuant to Section 4(a) hereof.",employee-benefit-plans
"Employee Benefit Plans. (a) For purposes of this Agreement, the following terms have the definitions given below:",employee-benefit-plans
"Employee Benefit Plans. Maintain each employee benefit plan as to which the Borrower may have any liability, in compliance with all applicable requirements of law and regulations.",employee-benefit-plans
"Employee Benefit Plans. The Company does not have any ""employee benefit plan"" as defined in the Employee Retirement Income Security Act of 1974, as amended.",employee-benefit-plans
"Employee Benefit Plans. (a) Neither the Company nor any entity which is or was under common control within the meaning of Section 414(b), (c), (m) or (o) of the Code maintains or contributes to, or has within the preceding six years maintained or contributed to, or may have any liability with respect to any employee benefit plan subject to Title IV of Employee Retirement Income Security Act of 1974, as amended (""ERISA""), or Section 412 of the Code or any ""multiple employer plan"" within the meaning of the Code or ERISA. Each employee benefit plan, arrangement, policy, program, agreement or commitment which the Company maintains, contributes to or may have any liability in respect to (each, a ""Plan"") has been established and administered in accordance with its terms, and complies in form and in operation with the applicable requirements of ERISA, the Code and other applicable Requirements of Law. No claim with respect to the administration or the investment of the assets of any Plan (other than routine claims for benefits) is pending. No event has occurred in connection with which the Company or any Plan, directly or indirectly, could be subject to any material liability under ERISA, the Code or any other law, regulation or governmental order applicable to any Plan, or under any agreement, instrument, statute, rule of law or regulation pursuant to or under which the Company has agreed to indemnify any person against liability incurred under, or for a violation or failure to satisfy the requirement of, any such statute, regulation or order. The Company has no liability, whether absolute or contingent, including any obligations under any Plan, with respect to any misclassification of any person as an independent contractor rather than as an employee.",employee-benefit-plans
"Employee Benefit Plans. (1) Except as described in Schedule 6.12, neither Seller nor any Affiliates (as defined below) have at any time established, sponsored, maintained, or made any contributions to, or been parties to any contract or other arrangement or been subject to any statute or rule requiring them to establish, maintain, sponsor, or make any contribution to, (i) any ""employee pension benefit plan"" (as defined in Section 3(2) of the Employee Retirement Income Security Act of 1974, as amended, and regulations thereunder (""ERISA"")) (""Pension Plan""); (ii) any ""employee welfare benefit plan"" (as defined in Section 3(1) of ERISA) (""Welfare Plan""); or (iii) any deferred compensation, bonus, stock option, stock purchase, or other employee benefit plan, agreement, commitment, or arrangement (""Other Plan""). Seller and the Affiliates have no obligations or liabilities (whether accrued, absolute, contingent, or unliquidated, whether or not known, and whether due or to become due) with respect to any ""employee benefit plan"" (as defined in Section 3(3) of ERISA), or Other Plan that is not listed in Schedule 6.12. For purposes of this Section 6.12, the term ""Affiliate"" shall include all persons under common control with Seller within the meaning of Sections 4001(a)(14) or (b)(1) of ERISA or any regulations promulgated thereunder, or Sections 414(b), (c), (m) or (o) of the Internal Revenue Code of 1986, as amended (the ""Code"").",employee-benefit-plans
"Employee Benefit Plans. (a) With respect to each material employee benefit plan, program, arrangement and contract (including, without limitation, any ""employee benefit plan"" as defined in Section 3(3) of ERISA) maintained or contributed to by Target or any trade or business which is under common control with Target within the meaning of Section 414 of the Code (the ""TARGET EMPLOYEE PLANS""), Target has made available to Acquiror a true and complete copy of, to the extent applicable, (i) such Target Employee Plan, (ii) the most recent annual report (Form 5500), (iii) each trust agreement related to such Target Employee Plan, (iv) the most recent summary plan description for each Target Employee Plan for which such a description is required, (v) the most recent actuarial report relating to any Target Employee Plan subject to Title IV of ERISA and (vi) the most recent IRS determination letter issued with respect to any Target Employee Plan.",employee-benefit-plans
"Employee Benefit Plans. (a) The Company has made available or delivered to Purchaser copies (or if the same do not exist in written form, descriptions) of each material formal, informal, oral or written bonus, deferred compensation, incentive compensation, stock purchase, stock option, restricted stock purchase or other issuance, severance or termination pay, hospitalization or other medical, life or other insurance (or similar self-insurance), supplemental unemployment benefits, profit-sharing, employee stock ownership, pension, or retirement plan, program, agreement or arrangement, and each other employee benefit plan, program, agreement or arrangement whether for the benefit of present or former officers, employees, agents, directors or independent contractors of the Company or any Subsidiary or any ERISA Affiliate, sponsored, maintained or contributed to or required to be contributed to by the Company or by any trade or business, whether or not incorporated (an ""ERISA Affiliate""), that together with the Company would be deemed a ""single employer"" within the meaning of Section 4001(b) of the Employee Retirement Income Security Act of 1974, as amended (""ERISA"") or Section 414 (b) or (c) of the Code (collectively, the ""Plans""). Each of the Plans that is an ""employee benefit plan,"" as that term is defined in section 3(3) of ERISA and subject thereto is collectively referred to herein as ""ERISA Plans.""",employee-benefit-plans
Employee Benefit Plans. Participation in any other employee benefit plans now existing or hereafter adopted by the Company for its employees.,employee-benefit-plans
"Employee Benefit Plans. In the event that the terms of any of the Company's employee benefit plans provide for the vesting or distribution of benefits on a date earlier than the date set forth in this Agreement, such earlier date shall prevail.",employee-benefit-plans
"Employee Benefit Plans. (i) There shall occur one or more ERISA Events or (ii) there shall exists any fact or circumstance that results or reasonably could be expected to result in the imposition of a Lien or security interest with respect to any Employee Benefit Plan under Section 412(n) of the Internal Revenue Code or under ERISA, in either case involving or that might reasonably be expected to involve in any individual case an amount in excess of $5,000,000 or in the aggregate at any time an amount in excess of $10,000,000; or",employee-benefit-plans
"Employee Benefit Plans. (a) Except as provided in writing to Purchaser and as listed on Exhibit 3.29, with respect to all employees and former employees of Seller and all dependents and beneficiaries of such employees and former employees, (i) Seller does not maintain or contribute to any non-qualified deferred compensation or retirement plans, contracts or arrangements, (ii) Seller does not maintain or contribute to any qualified defined contribution plans as defined in Section 3(34) of ERISA or Section 414(i) of the Code, (iii) Seller does not maintain or contribute to any qualified defined benefit plans as defined in Section 3(35) of ERISA or Section 414(j) of the Code, and (iv) Seller does not maintain or contribute to any employee welfare benefit plans as defined in Section 3(1) of ERISA.",employee-benefit-plans
"Employee Benefit Plans. Except as set forth on Schedule 3(a)(xiv), the Company does not have any Employee Benefit Plan as defined in the Employee Retirement Income Security Act of 1974.",employee-benefit-plans
"Employee Benefit Plans. No Participant may make any such assignment, conveyance or transfer to or in connection with any arrangement or understanding in any way involving any employee benefit plan (or its related trust), as defined in Section 3(3) of ERISA, or with the assets of any such plan (or its related trust), as defined in Section 4975(e)(1) of the Code.",employee-benefit-plans
"Employee Benefit Plans. The Executive will be eligible to participate on substantially the same basis as the Company’s other senior executive officers in any employee benefit plans offered by the Company including, without limitation, the Company’s 401(k) Lost Benefit Plan (or any successor thereto), medical, dental, short-term and long-term disability, life, pension, profit sharing and nonqualified deferred compensation arrangements. The Company reserves the right to modify, suspend or discontinue any and all of the plans, practices, policies and programs at any time without recourse by the Executive, so long as Company takes such action generally with respect to other similarly situated senior executive officers.",employee-benefit-plans
"Employee Benefit Plans. (a) Except as set forth in the Disclosure Schedule, with respect to the employee benefit plans, as defined in Section 3(3) of ERISA, sponsored or otherwise maintained by FIC or any of the FIC Subsidiaries, whether written or oral, in which FIC or any of the FIC Subsidiaries participates as a participating employer; to which FIC or any of the FIC Subsidiaries contributes and including any such plans which within the preceding six years have been terminated, merged into another plan of FIC or any of the FIC Subsidiaries, frozen or discontinued (collectively, ""FIC Plans""): (i) all such FIC Plans have been, in all respects, maintained in compliance with the requirements prescribed by all applicable statutes, orders and governmental rules or regulations, including, without limitation, ERISA, the Code, and Treasury and Labor Regulations promulgated thereunder, (ii) all FIC Plans intended to constitute tax-qualified plans under Section 401(a) of the Code have complied since their adoption in all material respects with applicable requirements of the Code and the Treasury Regulations promulgated thereunder, and have, except with respect to plan amendments for which the remedial amendment period under Code Section 401(b) has not yet elapsed, received favorable determination letters from the IRS, and FIC is not aware of any circumstances likely to result in revocation of any such favorable determination letter; (iii) each FIC Plan subject to ERISA or intended to be qualified under Section 401(a) of the Code has been and, if applicable, is being operated in all material respects in accordance with the applicable provisions of ERISA and the Code and the Department of Treasury Regulations promulgated thereunder; (iv) except for the FIC common stock held by its trustee as an asset of the FIC 401k Plan, no FIC Plan (or its related trust) holds any stock or other securities of FIC or any related or affiliated person or entity; (v) FIC has not engaged in any transaction that may subject FIC, or any FIC Plan, to a civil penalty imposed by Section 502 of ERISA; (vi) no prohibited transaction (as defined in Section 406 of ERISA and as defined in Section 4975(c) of the Code) has occurred with respect to any FIC Plan; (vi) to the knowledge of FIC, there are no actions, suits, proceedings or claims pending (other than routine claims for benefits) or threatened, against FIC, any of the FIC Subsidiaries, any FIC Plan, any fiduciary of any FIC Plan or the assets of any FIC Plan.",employee-benefit-plans
"Employee Benefit Plans. (a) The Company operates in a co-employer relationship with TriNet Group Inc. (“TriNet”), a Professional Employer Organization, and each reference to an employee of the Company in this Agreement includes any Person who is co-employed with TriNet. Section 3.14(a) of the Disclosure Schedule contains a true, complete and correct list of all (i) Employee Benefit Plans and (ii) all benefits provided by the Company or TriNet to employees of the Company or to Persons whose services are utilized in the conduct of the Company’s business. Neither the Company nor any ERISA Affiliate has any agreement, arrangement, commitment or obligation, whether formal or informal, whether written or unwritten and whether legally binding or not, to create, enter into or contribute to any additional Employee Benefit Plan, or to modify or amend any existing Employee Benefit Plan. There has been no amendment, interpretation or other announcement (written or oral) by the Company, any ERISA Affiliate or any other Person relating to, or change in participation or coverage under, any Employee Benefit Plan that, either alone or together with other such items or events, could materially increase the expense of maintaining such Employee Benefit Plan (or the Employee Benefit Plans taken as a whole) above the level of expense incurred with respect thereto for the most recent fiscal year",employee-benefit-plans
"Employee Benefit Plans. (a) Schedule 5.23 contains a correct and complete list identifying each material “employee benefit plan,” as defined in Section 3(3) of ERISA, each employment, severance or similar contract, plan, arrangement or policy and each other plan or arrangement (written or oral) providing for compensation, bonuses, profit-sharing, stock option or other stock related rights or other forms of incentive or deferred compensation, vacation benefits, insurance (including any self-insured arrangements), health or medical benefits, employee assistance program, disability or sick leave benefits, workers’ compensation, supplemental unemployment benefits, severance benefits and post-employment or retirement benefits (including compensation, pension, health, medical or life insurance benefits) which is maintained, administered or contributed to by the Company or any ERISA Affiliate and covers any employee or former employee of the Company, or with respect to which the Company has any liability. Copies of such plans (and, if applicable, related trust or funding agreements or insurance policies) and all amendments thereto and written interpretations thereof have been furnished to Parent together with the most recent annual report (Form 5500 including, if applicable, Schedule B thereto) and tax return (Form 990) prepared in connection with any such plan or trust. Such plans are referred to collectively herein as the “Employee Plans.”",employee-benefit-plans
"Employee Benefit Plans. Neither the Company nor any ERISA Affiliate maintains or contributes to, any Employee Benefit Plan. Each Employee Benefit Plan that is subject to ERISA or the Code is in substantial compliance with ERISA and the Code. True and complete copies of all Employee Benefit Plans, including, but not limited to, any trust instruments and insurance contracts forming a part of any Employee Benefit Plans, and all amendments thereto have been provided or made available to Parent. Each Pension Plan which is intended to meet the requirements of Section 401(a) of the Code has been determined by the Internal Revenue Service to be ""qualified"" within the meaning of the Code with respect to ""TRA"" (as defined in Section 1 of Rev. Proc. 93-39) or will be filed with the Internal Revenue Service with a request for a determination letter on or prior to the end of the applicable remedial amendment period and, to the knowledge of the Company, there are no facts which would adversely affect the tax qualified status of any Pension Plan.",employee-benefit-plans
"Employee Benefit Plans. (a) FPB Disclosure Schedule 3.15(a) sets forth a true and complete list of each FPB Benefit Plan. For purposes of this Agreement, “FPB Benefit Plans” means all benefit and compensation plans, contracts, policies or arrangements (i) covering current or former employees of FPB, any of its Subsidiaries or any of FPB’s related organizations described in Code Sections 414(b), (c) or (m), or any entity which is considered one employer with FPB, any of its Subsidiaries or Controlled Group Members under Section 4001 of ERISA or Section 414 of the Code (“ERISA Affiliates”) (such current employees collectively, the “FPB Employees”), (ii) covering current or former directors of FPB, any of its Subsidiaries, or ERISA Affiliates, or (iii) with respect to which FPB or any of its Subsidiaries has or may have any liability or contingent liability (including liability arising from ERISA Affiliates) including, but not limited to, “employee benefit plans” within the meaning of Section 3(3) of ERISA, health/welfare, employment, severance, change-of-control, fringe benefit, deferred compensation, defined benefit plan, defined contribution plan, stock option, stock purchase, stock appreciation rights, stock based, incentive, bonus plans, retirement plans and other policies, plans or arrangements whether or not subject to ERISA.",employee-benefit-plans
