clause_text,clause_type
"Employee Benefit Plans. During the term of this Agreement, Executive shall be entitled to participate in and receive the benefits of any Employee Benefit Plan currently in effect at Corporation, until such time that the Board of Directors of Corporation authorizes a change in such benefits. Executive shall also be entitled to participate in any stock option and profit sharing plans that Corporation may have in effect, subject to the terms and conditions of those plans. Nothing paid to Executive under any plan or arrangement presently in effect or made available in the future shall be deemed to be in lieu of the salary payable to Executive pursuant to Section 5(a) hereof.",employee-benefit-plans
Employee Benefit Plans. The Company does not have any “Employee Benefit Plan” as defined in the U.S. Employee Retirement Income Security Act of 1974 or similar plans under applicable laws.,employee-benefit-plans
"Employee Benefit Plans. (i) Based on the latest valuation of each Employee Benefit Plan that either Borrower or any ERISA Affiliate maintains or contributes to, or has any obligation under (which occurred within twelve months of the date of this representation), the aggregate benefit liabilities of such plan within the meaning of Section 4001 of ERISA did not exceed the aggregate value of the assets of such plan. Neither Borrower nor any ERISA Affiliate has any liability with respect to any post-retirement benefit under any Employee Benefit Plan which is a welfare plan (as defined in section 3(1) of ERISA), other than liability for health plan continuation coverage described in Part 6 of Title I(B) of ERISA, which liability for health plan contribution coverage is not reasonably likely to have a Material Adverse Effect.",employee-benefit-plans
"Employee Benefit Plans. There shall occur one or more ERISA Events which individually or in the aggregate results in or might reasonably be expected to result in liability of Holdings or any of its Subsidiaries in excess of $7,500,000 during the term of this Agreement; or",employee-benefit-plans
Employee Benefit Plans. 5.01 The compensation and other matters provided for in Section 4 above are in addition to the benefits provided for in this Section 5.,employee-benefit-plans
"Employee Benefit Plans. The Lessor is not and will not be making its investment hereunder, and is not performing its obligations under the Operative Documents, with the assets of an ""employee benefit plan"" (as defined in Section 3(3) of ERISA) which is subject to Title I of ERISA, or ""plan"" (as defined in Section 4975(e)(1)) of the Code.",employee-benefit-plans
"Employee Benefit Plans. (a) Set forth on Schedule 3.30(a) is a complete and correct list of all “employee benefit plans” (as defined in the Employee Retirement Income Security Act of 1974, as amended (“ERISA”)), all “multi employer plans” (as defined in ERISA), all specified fringe benefit plans as defined in Code § 6039D, and all other bonus, incentive, compensation, deferred compensation, profit sharing, stock option, stock appreciation right, stock bonus, stock purchase, employee stock ownership, savings, severance, supplemental unemployment, layoff, salary continuation, retirement, pension, health, life insurance, disability, group insurance, vacation, holiday, sick leave, fringe benefit or welfare plan or any other similar plan, agreement, policy or understanding (whether written or oral, qualified or nonqualified, currently effective or terminated), and any trust, escrow or other agreement related thereto, which (i) are maintained or contributed to by PCCI or the Bank, or with respect to which PCCI or the Bank has any liability during the last five years, and (ii) provide benefits, or describe policies or procedures applicable to, or for the welfare of any officer, director, independent contractor, employee, service provider, former officer or former employee of PCCI or the Bank, or the dependents or spouses of any such person, regardless of whether funded (the ”Employee Plans”). True, accurate and complete copies of the documents comprising each Employee Plan, including each trust, funding vehicle (including all annuity contracts, insurance contracts, and other funding instruments), the most current determination letter issued by the Internal Revenue Service, Form 5500 Annual Reports for the three most recent plan years, documents, records, policies, procedures or other materials related thereto, has been delivered to PCBC and are included and specifically identified in Schedule 3.30(a). No unwritten amendment exists with respect to any Employee Plan.",employee-benefit-plans
"Employee Benefit Plans. Except as provided in Section 4.12, the Assuming Bank shall have no liabilities, obligations or responsibilities under the Failed Bank's health care, bonus, vacation, pension, profit sharing or stock purchase plans or similar plans, if any, unless the Receiver and the Assuming Bank agree otherwise subsequent to the date of this Agreement.",employee-benefit-plans
Employee Benefit Plans. There shall occur one or more ERISA Events which individually or in the aggregate results in or could reasonably be expected to result in a Material Adverse Effect; or,employee-benefit-plans
"Employee Benefit Plans. With respect to each Plan, the Borrower and its ERISA Affiliates are in compliance in all material respects with the applicable provisions of ERISA and the Code and the final regulations and published interpretations thereunder. No ERISA Event has occurred that alone or together with any other ERISA Event has resulted or could reasonably be expected to result in a Material Adverse Change. Neither the Borrower nor any ERISA Affiliate has incurred any Withdrawal Liability that could result in a Material Adverse Change. Neither the Borrower nor any ERISA Affiliate has received any notification that any Multiemployer Plan is in reorganization or has been terminated within the meaning of Title IV of ERISA, which such reorganization or termination could result in a Material Adverse Change, and no Multiemployer Plan is reasonably expected to be in reorganization or to be terminated where such reorganization or termination has resulted or can reasonably be expected to result, through an increase in the contributions required to be made to such Plan or otherwise, in a Material Adverse Change.",employee-benefit-plans
"Employee Benefit Plans. A. Company, each of its Subsidiaries and each of their respective ERISA Affiliates are in substantial compliance with all applicable material provisions and requirements of ERISA and the regulations and published interpretations thereunder with respect to each Employee Benefit Plan, and have performed all their obligations under each Employee Benefit Plan except to the extent that any such noncompliance or nonperformance could not reasonably be expected to have a Material Adverse Effect. Each Employee Benefit Plan which is intended to qualify under Section 401(a) of the Internal Revenue Code is so qualified except as could not reasonably be expected to have a Material Adverse Effect.",employee-benefit-plans
"Employee Benefit Plans. A. Company and each of its ERISA Affiliates are in compliance with all applicable provisions and requirements of ERISA and the regulations and published interpretations thereunder with respect to each Employee Benefit Plan, and have performed all their obligations under each Employee Benefit Plan.",employee-benefit-plans
"Employee Benefit Plans. (a) Schedule 4.15(a) attached hereto contains a true and correct list of each material employment, bonus, deferred compensation, incentive compensation, stock purchase, stock option, stock appreciation right or other stock-based incentive, severance, change-in-control, or termination pay, hospitalization or other medical, retiree medical, disability, life or other insurance, supplemental unemployment benefits, profit-sharing, pension, retention, or retirement plan, program, agreement or arrangement and each other material employee benefit plan, program, agreement or arrangement, sponsored, maintained or contributed to or required to be contributed to by Seller, or by any trade or business, whether or not incorporated (an “ERISA Affiliate”), that together with Seller would be deemed a “single employer” within the meaning of Section 4001(b)(1) of ERISA, for the benefit of any Employee or former employee of the Business, whether formal or informal and whether legally binding or not (the “Plans”). Schedule 4.15(a) attached hereto includes each of the Plans, if any, that is an “employee welfare benefit plan” or “employee pension benefit plan” as such terms are defined in Sections 3(1) and 3(2) of ERISA (such plans collectively, the “ERISA Plans”). Except as disclosed in Schedule 4.15(a) attached hereto, none of Seller nor any ERISA Affiliate has any formal plan or commitment, whether legally binding or not, to create any additional Plan or modify or change any existing Plan that would affect any Employee or former employee or director of the Business in a manner which could reasonably be expected to constitute or result in a Material Adverse Effect.",employee-benefit-plans
"Employee Benefit Plans. Except as could not reasonably be expected to result in a Material Adverse Effect, the Borrower and each ERISA Affiliate is in compliance with the applicable provisions of ERISA and, in respect of the Benefit Plans and Multiemployer Plans, the Tax Code and the regulations and published interpretations thereunder. No ERISA Event has occurred or is reasonably expected to occur that, when taken together with all other such ERISA Events, could reasonably be expected to result in a Material Adverse Effect.",employee-benefit-plans
"Employee Benefit Plans. Each employee benefit plan as to which the Borrower may have any liability complies in all material respects with all applicable provisions of the Employee Retirement Income Security Act of 1974 (as amended from time to time, “ERISA”), including minimum funding requirements, and (i) no Prohibited Transaction (as defined under ERISA) has occurred with respect to any such plan, (ii) no Reportable Event (as defined under Section 4043 of ERISA) has occurred with respect to any such plan which would cause the Pension Benefit Guaranty Corporation to institute proceedings under Section 4042 of ERISA, (iii) the Borrower has not withdrawn from any such plan or initiated steps to do so, and (iv) no steps have been taken to terminate any such plan.",employee-benefit-plans
"Employee Benefit Plans. Except as set forth in Schedule 6.17, the Company does not have and has not ever maintained, and has no Obligations with respect to any employee benefit plans or arrangements, including employee pension benefit plans, as defined in Section 3(2) of the Employee Retirement Income Security Act of 1974, as amended (“ERISA”), multiemployer plans, as defined in Section 3(37) of ERISA, employee welfare benefit plans, as defined in Section 3(1) of ERISA, deferred compensation plans, stock option plans, bonus plans, stock purchase plans, hospitalization, disability and other insurance plans, severance or termination pay plans and policies, whether or not described in Section 3(3) of ERISA, in which employees, their spouses or dependents of the Company participate (collectively, the “Employee Benefit Plans”). To the Company’s knowledge, all Employee Benefit Plans meet the minimum funding standards of Section 302 of ERISA, where applicable, and each such Employee Benefit Plan that is intended to be qualified within the meaning of Section 401 of the Internal Revenue Code of 1986 is qualified. No withdrawal liability has been incurred under any such Employee Benefit Plans and no “Reportable Event” or “Prohibited Transaction” (as such terms are defined in ERISA), has occurred with respect to any such Employee Benefit Plans, unless approved by the appropriate Governmental Authority. To the Company’s knowledge, the Company has promptly paid and discharged all Obligations arising under ERISA of a character which if unpaid or unperformed might result in the imposition of an Encumbrance against any of its Assets or otherwise have a Material Adverse Effect.",employee-benefit-plans
"Employee Benefit Plans. The Company does not maintain, nor has the Company maintained in the past, any employee benefit plans (""as defined in Section 3(3) of the Employee Retirement Income Security Act of 1974, as amended (""ERISA"")), or any plans, programs, policies, practices, arrangements or contracts (whether group or individual) providing for payments, benefits or reimbursements to employees of the Company, former employees, their beneficiaries and dependents under which such employees, former employees, their beneficiaries and dependents are covered through an employment relationship with the Company, any entity required to be aggregated in a controlled group or affiliated service group with the Company for purposes of ERISA or the Internal Revenue Code of 1986 (the ""Code"") (including, without limitation, under Section 414(b), (c), (m) or (o) of the Code or Section 4001 of ERISA, at any relevant time (""Benefit Plans"").",employee-benefit-plans
"Employee Benefit Plans. (a) For purposes of this Agreement, “Parent Employee Plans” means all employee benefit plans (as defined in Section 3(3) of ERISA), whether or not subject to ERISA, and all bonus, stock option, stock purchase, restricted stock, stock unit, incentive, deferred compensation, retiree medical or life insurance, supplemental retirement, severance or other benefit plans, programs or arrangements, and all retention, bonus, employment, termination, severance plans, programs or arrangements or other contracts or agreements to or with respect to which Parent or any Subsidiary or any trade or business of Parent or any of its Subsidiaries, whether or not incorporated, all of which together with Parent would be deemed a “single employer” within the meaning of Section 4001 of ERISA (a “Parent ERISA Affiliate”), is a party or has any current or future obligation or that are maintained, contributed to or sponsored by Parent or any of its Subsidiaries or any Parent ERISA Affiliate for the benefit of any current or former employee, officer, director or independent contractor of Parent or any of its Subsidiaries or any Parent ERISA Affiliate.",employee-benefit-plans
"Employee Benefit Plans. (a) Seller has disclosed in Section 4.15 of the Seller Disclosure Memorandum, and has delivered or made available to Buyer prior to the execution of this Agreement, (i) copies of each Employee Benefit Plan currently adopted, maintained by, sponsored in whole or in part by, or contributed or required to be contributed to by any Seller Entity or ERISA Affiliate thereof for the benefit of employees, former employees, retirees, dependents, spouses, directors, independent contractors, or other beneficiaries or under which employees, retirees, former employees, dependents, spouses, directors, independent contractors, or other beneficiaries are eligible to participate (each, a “Seller Benefit Plan,” and collectively, the “Seller Benefit Plans”) and (ii) a list of each Employee Benefit Plan that is not identified in (i) above (e.g., former Employee Benefit Plans) but for which any Seller Entity or ERISA Affiliate has or reasonably could have any obligation or Liability. Any of the Seller Benefit Plans which is an “employee pension benefit plan,” as that term is defined in ERISA Section 3(2), is referred to herein as a “Seller ERISA Plan.” Each Seller ERISA Plan which is also a “defined benefit plan” (as defined in Code Section 414(j)) is referred to herein as a “Seller Pension Plan,” and is identified as such in Section 4.15 of the Seller Disclosure Memorandum.",employee-benefit-plans
"Employee Benefit Plans. Employee shall be eligible to participate in the employee benefit plans, programs and policies maintained by the Company for similarly situated employees in accordance with the terms and conditions to participate in such plans, programs, and policies as in effect from time to time.",employee-benefit-plans
"Employee Benefit Plans. (a) Section 4.18 of the Company Disclosure Schedule contains a list identifying each (i) ""employee benefit plan,"" as defined in Section 3(3) of ERISA, (ii) material employment, severance or similar contract, plan, arrangement or policy, or (iii) other material plan or arrangement providing for compensation, bonuses or incentive compensation, profit sharing, stock option or stock related rights, deferred compensation, vacation benefits, insurance (including any self insured arrangements), health or medical benefits, employee assistance program, disability or sick leave benefits, workers' compensation, supplemental unemployment benefits, severance benefits and post employment or retirement benefits (including compensation, pension, health, medical or life insurance benefits) which is maintained, administered or contributed to by the Company or any ERISA Affiliate of the Company and covers any employee or former employee of the Company or any of its Subsidiaries, or with respect to which the Company or any of its Subsidiaries has any material liability (collectively, ""EMPLOYEE PLANS"").",employee-benefit-plans
Employee Benefit Plans. Neither the Borrower nor any ERISA Affiliate will,employee-benefit-plans
"Employee Benefit Plans. The Company is in compliance in all material respects with all presently applicable provisions of the Employee Retirement Income Security Act of 1974, as amended, including the regulations and published interpretations thereunder (“ERISA”); no “reportable event” (as defined in ERISA) has occurred with respect to any “pension plan” (as defined in ERISA) for which the Company would have any liability; the Company has not incurred and does not expect to incur liability under (i) Title IV of ERISA with respect to termination of, or withdrawal from, any “pension plan” or (ii) Sections 412 or 4971 of the Internal Revenue Code of 1986, as amended, including the regulations and published interpretations thereunder (the “Code”); and each “pension plan” for which the Company would have any liability that is intended to be qualified under Section 401(a) of the Code is so qualified in all material respects and nothing has occurred, whether by action or by failure to act, which would cause the loss of such qualification. To the Company’s knowledge, the Company has promptly paid and discharged all Obligations arising under ERISA of a character which if unpaid or unperformed might result in the imposition of an Encumbrance against any of its Assets or otherwise have a Material Adverse Effect.",employee-benefit-plans
"Employee Benefit Plans. The Company has no (a) non-qualified deferred or incentive compensation or retirement plans or arrangements, (b) qualified retirement plans or arrangements, (c) other employee compensation, severance or termination pay or welfare benefit plans, programs or arrangements or (d) any related trusts, insurance contracts or other funding arrangements maintained, established or contributed to by the Company.",employee-benefit-plans
"Employee Benefit Plans. (i) In the case of the representations and warranties of USBC, USBC's Disclosure Schedule contains a complete list of all bonus, vacation, deferred compensation, pension, retirement, profit-sharing, thrift, savings, employee stock ownership, stock bonus, stock purchase, restricted stock, stock appreciation and stock option plans, all employment or severance contracts, all medical, dental, disability, severance, health and life plans, all other employee benefit and fringe benefit plans, contracts or arrangements and any ""change of control"" or similar provisions in any plan, contract or arrangement maintained or contributed to by it or any of its Subsidiaries for the benefit of officers, former officers, employees, former employees, directors, former directors, or the beneficiaries of any of the foregoing (collectively, ""Compensation and Benefit Plans"").",employee-benefit-plans
"Employee Benefit Plans. Schedule 3.18 contains a list setting forth each employee benefit plan or arrangement of the Company, including but not limited to employee pension benefit plans, as defined in Section 3(2) of the Employee Retirement Income Security Act of 1974, as amended (""ERISA""), multiemployer plans, as defined in Section 3(37) of ERISA, employee welfare benefit plans, as defined in Section 3(1) of ERISA, deferred compensation plans, stock option plans, bonus plans, stock purchase plans, hospitalization, disability and other insurance plans, severance or termination pay plans and policies, whether or not described in Section 3(3) of ERISA, in which employees, their spouses or dependents, of the Company participate (""Employee Benefit Plans"") (true and accurate copies of which, together with the most recent annual reports on Form 5500 and summary plan descriptions with respect thereto, were furnished to Medical Manager).",employee-benefit-plans
"Employee Benefit Plans. Except as would not reasonably be expected, individually or in the aggregate, to have a Material Adverse Effect: (i) no “reportable event” within the meaning of Section 4043(c) of ERISA has occurred during the past five years as to which the Company, any of its Subsidiaries or any ERISA Affiliate was required to file a report with the PBGC; (ii) no ERISA Event has occurred or is reasonably expected to occur; and (iii) none of the Company, any of its Subsidiaries or any of their respective ERISA Affiliates has received any written notification that any “multiemployer plan” (as defined in Section 4001(a)(15) of ERISA) is in reorganization or has been terminated within the meaning of Title IV of ERISA.",employee-benefit-plans
"Employee Benefit Plans. The Company shall maintain, and cause each of its Subsidiaries to maintain, each Plan as to which it may have liability, in compliance with all applicable requirements of law and regulations.",employee-benefit-plans
"Employee Benefit Plans. Borrower, each of its Subsidiaries and each ERISA Affiliate is in compliance in all material respects with all applicable provisions of ERISA, the IRC and all other applicable laws and the regulations and interpretations thereof with respect to all Employee Benefit Plans. No material liability has been incurred by Borrower, any Subsidiaries or any ERISA Affiliate which remains unsatisfied for any funding obligation, taxes or penalties with respect to any Employee Benefit Plan.",employee-benefit-plans
"Employee Benefit Plans. (a) iPrint has set forth in the iPrint Disclosure Schedule a complete and accurate list of each plan, program, policy, practice, contract, agreement or other arrangement providing for employment, compensation, retirement, deferred compensation, loans, severance, separation, relocation, repatriation, expatriation, visas, work permits, termination pay, performance awards, bonus, incentive, stock option, stock purchase, stock bonus, phantom stock, stock appreciation right, supplemental retirement, fringe benefits, cafeteria benefits, or other benefits, whether written or unwritten, including, without limitation, each ""employee benefit plan"" within the meaning of Section 3(3) of ERISA which is or has been sponsored, maintained, contributed to, or required to be contributed to by iPrint, any subsidiary of iPrint and, with respect to any such plans which are subject to Code Section 401(a), any trade or business (whether or not incorporated) which is or, at any relevant time, was treated as a single employer with iPrint within the meaning of Section 414(b), (c),(m) or (o) of the Code, (a ""iPrint ERISA Affiliate"") for the benefit of any ---------------------- person who performs or who has performed services for iPrint or with respect to which iPrint, any subsidiary, or iPrint ERISA Affiliate has or may have any liability (including, without limitation, contingent liability) or obligation (collectively, the ""iPrint Employee Plans""). --------------------- (b)",employee-benefit-plans
"Employee Benefit Plans. (a) Innes Street DISCLOSURE SCHEDULE 3.12 includes a list of all existing bonus, incentive, deferred compensation, pension, retirement, profit-sharing, thrift, savings, employee stock ownership, stock bonus, stock purchase, restricted stock, stock option, stock appreciation, phantom stock, severance, welfare and fringe benefit plans, employment, severance and change in control agreements and all other benefit practices, policies and arrangements maintained by Innes Street or Citizens Bank in which any employee or former employee, consultant or former consultant or director or former director of Innes Street or Citizens Bank participates or to which any such employee, consultant or director is a party or is otherwise entitled to receive benefits other than plans and programs involving immaterial obligations (the ""Compensation and Benefit Plans""). Neither Innes Street nor Citizens Bank has any commitment to create any additional Compensation and Benefit Plan or to modify, change or renew any existing Compensation and Benefit Plan, except as required to maintain the qualified status thereof. Innes Street has made available to Gaston Bancorp true and correct copies of the Compensation and Benefit Plans.",employee-benefit-plans
