clause_text,clause_type
"ERISA. Each of the Company and its subsidiaries has fulfilled its obligations, if any, under the minimum funding standards of Section 302 of the United States Employee Retirement Income Security Act of 1974 (“ERISA”) and the regulations and published interpretations thereunder with respect to each “plan” (as defined in Section 3(3) of ERISA and such regulations and published interpretations) in which employees of the Company and its subsidiaries are eligible to participate and each such plan is in compliance in all material respects with the presently applicable provisions of ERISA and such regulations and published interpretations. The Company and its subsidiaries have not incurred any unpaid liability to the Pension Benefit Guaranty Corporation (other than for the payment of premiums in the ordinary course) or to any such plan under Title IV of ERISA.",erisa
"ERISA. Borrower is not and will not be an “employee benefit plan” as defined in Section 3(3) of ERISA, which is subject to Title I of ERISA. The assets of Borrower do not and will not constitute “plan assets” of one or more such plans within the meaning of 29 C.F.R. Sec. 2510.3-101. Borrower is not and will not be a “governmental plan” within the meaning of Section 3(32) of ERISA. Transactions by or with Borrower are not and will not be subject to any state or other statute, regulation or other restriction regulating investments of, or fiduciary obligations with respect to, governmental plans within the meaning of Section 3(32) of ERISA which is similar to the provisions of Section 406 of ERISA or Section 4975 of the Code and which prohibit or otherwise restrict the transactions contemplated by this Agreement, including but not limited to the exercise by Lender of any of its rights under the Security Documents. Neither Borrower, nor any member of a “controlled group of corporations” (within the meaning of Section 414 of the Code) maintains, sponsors or contributes to a “defined benefit plan” (within the meaning of Section 3(35) of ERISA) or a “multiemployer pension plan” (within the meaning of Section 3(37)(A) of ERISA).",erisa
"ERISA. Promptly upon a Responsible Officer of any Borrower obtaining knowledge thereof, Lead Borrower will deliver to the Administrative Agent a certificate of a Responsible Officer of Lead Borrower setting forth the full details as to such occurrence and the action, if any, that Lead Borrower, such Restricted Subsidiary or an ERISA Affiliate is required or proposes to take, together with any notices required or proposed to be given or filed by Lead Borrower, such Restricted Subsidiary, the Plan administrator or such ERISA Affiliate to or with the PBGC or any other Governmental Authority, or a Plan participant and any notices received by Lead Borrower, such Restricted Subsidiary or such ERISA Affiliate from the PBGC or any other Governmental Authority, or a Plan participant with respect thereto: that (a) an ERISA Event has occurred that is reasonably expected to result in a Material Adverse Effect; (b) there has been an increase in Unfunded Pension Liabilities since the date the representations hereunder are given, or from any prior notice, as applicable, in either case, which is reasonably expected to result in a Material Adverse Effect; (c) there has been an increase in the estimated withdrawal liability under Section 4201 of ERISA, if Lead Borrower, any Restricted Subsidiary of Lead Borrower and the ERISA Affiliates were to withdraw completely from any and all Multiemployer Plans which is reasonably expected to result in a Material Adverse Effect; (d) Lead Borrower, any Restricted Subsidiary of Lead Borrower or any ERISA Affiliate adopts, or commences contributions to, any Plan subject to Section 412 of the Code, or adopts any amendment to a Plan subject to Section 412 of the Code which is reasonably expected to result in a Material Adverse Effect; (e) that a contribution required to be made with respect to a Foreign Pension Plan has not been timely made which failure is reasonably likely to result in a Material Adverse Effect; or (f) that a Foreign Pension Plan has been or is reasonably expected to be terminated, reorganized, partitioned or declared insolvent and such event is reasonably expected to result in a Material Adverse Effect. Lead Borrower will also deliver to the Administrative Agent, upon request by the Administrative Agent, a complete copy of the most recent annual report (on Internal Revenue Service Form 5500-series, including, to the extent required, the related financial and actuarial statements and opinions and other supporting statements, ce...",erisa
"ERISA. It will, and will cause each of its Subsidiaries that are members of the Controlled Group to, comply in all material respects with the applicable provisions of ERISA and the Code except where any noncompliance, individually or in the aggregate, would not result in a Material Adverse Change.",erisa
"ERISA. Permit any ERISA Affiliates to do any of the following to the extent that such act or failure to act would result in the aggregate, after taking into account any other such acts or failure to act, in a Material Adverse Effect on Borrower or the REIT:",erisa
"ERISA. Each Lender as of the Closing Date represents and warrants as of the Closing Date to the Administrative Agent and the Arrangers and their respective Affiliates, and not, for the avoidance of doubt, for the benefit of the Borrower or any other Loan Party, that such Lender is not and will not be (a) an employee benefit plan subject to Title I of ERISA, (b) a plan or account subject to Section 4975 of the Code, (c) an entity deemed to hold “plan assets” of any such plans or accounts for purposes of ERISA or the Code or (d) a “governmental plan” within the meaning of ERISA.",erisa
"ERISA. Except in such instances where an omission or failure would not result in a Material Adverse Change, Borrower will not, nor will Borrower permit any of its Subsidiaries to (a) take any action or fail to take any action which would result in a violation of ERISA, the Code or other laws applicable to the Plans maintained or contributed to by it or any ERISA Affiliate, or (b) modify the term of, or the funding obligations or contribution requirements under any existing Plan, establish a new Plan, or become obligated or incur any liability under a Plan that is not maintained or contributed to by a Borrower or any ERISA Affiliate as of the Closing Date.",erisa
"ERISA. Borrower hereby represents, warrants and agrees that: (i) it is acting on its own behalf and that it is not an employee benefit plan as defined in Section 3(3) of the Employee Retirement Income Security Act of 1974, as amended (“ERISA”), which is subject to Title 1 of ERISA, nor a plan as defined in Section 4975(e)(1) of the Internal Revenue Code of 1986, as amended (each of the foregoing hereinafter referred to collectively as a “Plan”); (ii) Borrower’s assets do not constitute “plan assets” of one or more such Plans within the meaning of Department of Labor Regulation Section 2510.3-101; and (iii) it will not be reconstituted as a Plan or as an entity whose assets constitute “plan assets”.",erisa
"ERISA. No reportable Event (as defined in Section 4043(b) of ERISA) has occurred with respect to any Plan. Each Plan complies with all applicable provisions of ERISA, and the Borrower has filed all reports required by ERISA and the Code to be filed with respect to each Plan. The Borrower has no knowledge of any Event which could result in a liability of the Borrower to the Pension Benefit Guaranty Corporation. The Borrower has met all requirements with respect to funding any Plan proposed by ERISA or the Code. Since the effective date of Title IV of ERISA, there have not been any nor are there any Events or conditions now existing that would permit any Plan to be terminated under circumstances which would cause the lien provided under Section 4068 of ERISA to attach to any assets of the Borrower. The value of the Plan's benefits guaranteed under Title IV of ERISA on the date hereof does not exceed the value of such Plan's assets allocable to such benefits as of the date of this Agreement and shall not be permitted to do so hereafter.",erisa
"ERISA. The Employee Retirement Income Security Act of 1974, as amended from time to time.",erisa
"ERISA. (a) The Borrower is not a member of an ERISA Group and has no liability in respect of any Benefit Arrangement, Plan or Multiemployer Plan subject to ERISA.",erisa
"ERISA. (i) An ERISA Event shall occur with respect to a Pension Plan or Multiemployer Plan which has resulted or could reasonably be expected to result in liability of the Company under Title IV of ERISA to the Pension Plan, Multiemployer Plan or the PBGC in an aggregate amount in excess of $50,000,000; (ii) the aggregate amount of Unfunded Pension Liability among all Pension Plans at any time exceeds $50,000,000; or (iii) the Company or any ERISA Affiliate shall fail to pay when due, after the expiration of any applicable grace period, any installment payment with respect to its withdrawal liability under Section 4201 of ERISA under a Multiemployer Plan in an aggregate amount in excess of $50,000,000 and, in the case of any of clauses (i) through (iii), such liability or failure to pay shall not have been vacated, discharged, stayed, appealed or paid within ten (10) Business Days after such liability or payment obligation arises; or",erisa
"ERISA. (a)(i) An ERISA Event occurs with respect to a Plan subject to ERISA or Multiemployer Plan subject to ERISA which has resulted or could reasonably be expected to result in liability of any Loan Party under Title IV of ERISA in an aggregate amount which could reasonably be expected to result in a Material Adverse Effect, or (ii) any Loan Party or any ERISA Affiliate fails to pay when due, after the expiration of any applicable grace period, any installment payment with respect to its withdrawal liability under Section 4201 of ERISA under a Multiemployer Plan in an aggregate amount which could reasonably be expected to result in a Material Adverse Effect; or (b) except as could not reasonably be expected to result in a Material Adverse Effect, (i) a Pension Event shall occur which, in Collateral Agent’s determination, constitutes grounds for the termination under any Applicable Law, of any Plan or (ii) the appointment by the appropriate Governmental Authority of a trustee for any Plan, or (iii) if any Plan shall be terminated or any such trustee shall be requested or appointed, or (iv) if a Loan Party is in default with respect to payments to a Plan resulting from their complete or partial withdrawal from such Plan or (v) any event that may reasonably be expected to have a Material Adverse Effect or any Lien arises (save for contribution amounts not yet due) in connection with any Plan; or",erisa
"ERISA. No employee benefit plan (a ""Plan"") subject to the Employee Retirement Income Security Act of 1974 (""ERISA"") and regulations issued pursuant thereto that is maintained by Borrower or under which Borrower could have any liability under ERISA (a) has failed to meet minimum funding standards established in Section 302 of ERISA, (b) has failed to comply with all applicable requirements of ERISA and of the Internal Revenue Code, including all applicable rulings and regulations thereunder, (c) has engaged in or been involved in a prohibited transaction (as defined in ERISA) under ERISA or under the Internal Revenue Code, or (d) has been terminated. Borrower has not assumed, or received notice of a claim asserted against Borrower for, withdrawal liability (as defined in the Multi-Employer Pension Plan Amendments Act of 1980, as amended) with respect to any multi-employer pension plan and is not a member of any Controlled Group (as defined in ERISA). Borrower has timely made when due all contributions with respect to any multi-employer pension plan in which it participates and no event has occurred triggering a claim against Borrower for withdrawal liability with respect to any multi-employer pension plan in which Borrower participates.",erisa
"ERISA. ERISA"" shall mean the Employee Retirement Income Security Act of 1974.",erisa
"ERISA. For purposes of the Employee Retirement Income Security Act of 1974, this Agreement is intended to be a severance pay employee welfare benefit plan, and not an employee pension benefit plan, and shall be construed and administered with that intention.",erisa
"ERISA. (i) If the Borrower, any Borrower Affiliate or any of their ERISA Affiliates maintains any Pension Plan or any Multiemployer Plan, an ERISA Event occurs with respect to a Pension Plan or Multiemployer Plan which has resulted or could reasonably be expected to result in liability of the Borrower or any Borrower Affiliate under Title IV of ERISA to the Pension Plan, Multiemployer Plan or the PBGC in an aggregate amount in excess of $1,000,000, or (ii) if there is any Multiemployer Plan, the Borrower, any Borrower Affiliate or any ERISA Affiliate thereof fails to pay when due, after the expiration of any applicable grace period, any installment payment with respect to its withdrawal liability under Section 4201 of ERISA under a Multiemployer Plan in an aggregate amount in excess of $1,000,000; or",erisa
"ERISA. No Borrower shall, or shall cause or permit any ERISA Affiliate to, cause or permit to occur an event which could result in the imposition of a Lien under Section 412 of the IRC or Section 302 or 4068 of ERISA.",erisa
ERISA. The Borrower shall not:,erisa
ERISA. The Borrower shall not and shall not permit any of its Subsidiaries or ERISA Affiliates to:,erisa
"ERISA. Each Plan that is intended to qualify under Section 401(a) of the Code has received a favorable determination letter from the IRS or an application for such a letter is currently being processed by the IRS with respect thereto and, to the knowledge of Borrower, nothing has occurred which would prevent, or cause the loss of, such qualification. No application for a funding waiver or an extension of any amortization period pursuant to Section 412 of the Code has been made with respect to any Plan. There are no pending or, to the knowledge of Borrower, threatened claims, actions or lawsuits, or action by any Governmental Authority, with respect to any Plan. There has been no Prohibited Transaction or violation of the fiduciary responsibility rules with respect to any Plan. No ERISA Event has occurred or is reasonably expected to occur. No Plan has any Unfunded Pension Liability. No Obligated Party or ERISA Affiliate has incurred, or reasonably expects to incur, any liability under Title IV of ERISA with respect to any Plan (other than premiums due and not delinquent under Section 4007 of ERISA). No Obligated Party or ERISA Affiliate has incurred, or reasonably expects to incur, any liability (and no event has occurred which, with the giving of notice under Section 4219 of ERISA, would result in such liability) under Section 4201 or 4243 of ERISA with respect to a Multiemployer Plan. No Obligated Party or ERISA Affiliate has engaged in a transaction that could be subject to Section 4069 or 4212(c) of ERISA.",erisa
"ERISA. (a) The termination of any Plan or the institution by the PBGC of proceedings for the involuntary termination of any Plan, in either case, by reason of, or that results or could result in, a ""material accumulated funding deficiency"" under Section 412 of the Code; or",erisa
"ERISA. No notice of a Lien arising under Title I or Title IV of ERISA has been filed under Section 6323 (a) of the Code (or any successor provision) against, or otherwise affecting the assets NFC.",erisa
"ERISA. The assets that are used in connection with the execution, delivery and performance of this Agreement and the Transactions entered into pursuant hereto are not the assets of an employee benefit or other plan subject to Title I of the Employee Retirement Income Security Act of 1974, as amended (“ERISA”), a plan described in Section 4975 of the Internal Revenue Code of 1986, as amended (the “Code”), an entity whose underlying assets include “plan assets” by reason of Department of Labor regulation section 2510.3-101, or a governmental plan that is subject to any federal, state, or local law that is substantially similar to the provisions of Section 406 of ERISA or Section 4975 of the Code.”",erisa
"ERISA. Borrower has furnished to Bank true and complete copies of the latest annual report required to be filed pursuant to Section 104 of the Employee Retirement Income Security Act of 1974, as amended (""ERISA""), with respect to each employee benefit plan or other plan maintained for employees of Borrower or any Subsidiary and covered by Title IV of ERISA (a ""Plan""), and no Termination Event (as hereinafter defined) with respect to any Plan has occurred and is continuing. For the purposes of this Agreement, a ""Termination Event"" shall mean a ""reportable event"" as defined in Section 4043(b) of ERISA, or the filing of a notice of intent to terminate under Section 4041 of ERISA. Neither Borrower nor any Subsidiary has any unfunded liability with respect to any such Plan.",erisa
"ERISA. (i) Terminate or withdraw from, or permit any of its ERISA Affiliates to terminate or withdraw from, any Plan with respect to which the Borrower or any of its ERISA Affiliates may have any liability by reason of such termination or withdrawal, if such termination or withdrawal could have a Material Adverse Effect, (ii) incur a full or partial withdrawal, or permit any ERISA Affiliate to incur a full or partial withdrawal, from any Multiemployer Plan with respect to which the Borrower or any of its ERISA Affiliates may have any liability by reason of such withdrawal, if such withdrawal could have a Material Adverse Effect, (iii) otherwise fail, or permit any of its ERISA Affiliates to fail, to comply in all material respects with ERISA or the related provisions of the Internal Revenue Code if such noncompliances, singly or in the aggregate, could have a Material Adverse Effect, or (iv) fail, or permit any of its Subsidiaries to fail, to comply with Applicable Law with respect to any Foreign Plan if such noncompliances, singly or in the aggregate, could have a Material Adverse Effect.",erisa
"ERISA. Lessee is not engaged in any transaction in connection with which it could be subjected to either a civil penalty assessed pursuant to Section 502 of ERISA or any tax imposed by Section 4975 of the Internal Revenue Code; no material liability to the Pension Benefit Guaranty Corporation has been or is expected by Lessee to be incurred with respect to any employee pension benefit plan (as defined in Section 3 of ERISA) maintained by Lessee or by any trade or business (whether or not incorporated) which together with Lessee would be treated as a single employer under Section 4001 of ERISA and Section 414 of the Internal Revenue Code; there has been no reportable event (as defined in Section 4043(b) of ERISA) with respect to any such employee pension benefit plan; no notice of intent to terminate any such employee pension benefit plan has been filed or is expected to be filed, nor has any such employee pension benefit been terminated; no circumstance exists or is anticipated that constitutes or would constitute grounds under Section 4042 of ERISA for the Pension Benefit Guaranty Corporation to institute proceedings to terminate, or to appoint a trustee to manage the administration of, such an employee pension benefit plan; and no accumulated funding deficiency (as defined in Section 302 of ERISA or Section 412 of the Internal Revenue Code), whether or not waived, exists with respect to any such employee pension benefit plan.",erisa
"ERISA. No plan (as that term is defined in the Employee Retirement Income Security Act of 1974 (“ERISA”)) of the Borrower (a “Plan”) which is subject to Part 3 of Subtitle B of Title 1 of ERISA had an accumulated funding deficiency (as such term is defined in ERISA) as of the last day of the most recent fiscal year of such Plan ended prior to the date hereof, or would have had such an accumulated funding deficiency on such date if such year were the first year of such Plan, and no material liability to the Pension Benefit Guaranty Corporation has been, or is expected by the Borrower to be, incurred with respect to any such Plan. No Reportable Event (as defined in ERISA) has occurred and is continuing in respect to any such Plan.",erisa
"ERISA. (a) An ERISA Event has occurred with respect to a Plan or Multiemployer Plan which has resulted or would reasonably be expected to result in a Material Adverse Effect; (b) there is or arises Unfunded Pension Liability which has resulted or would reasonably be expected to result in a Material Adverse Effect, (c) there is or arises any withdrawal liability incurred by the Lead Borrower or any Restricted Subsidiary of the Lead Borrower under Section 4201 of ERISA, resulting from Lead Borrower, any Restricted Subsidiary of Lead Borrower or the ERISA Affiliates complete withdrawal from any or all Multiemployer Plans which has resulted or would reasonably be expected to result in a Material Adverse Effect, (d) a Foreign Pension Plan has failed to comply with, or be funded in accordance with, applicable law which has resulted or would reasonably be expected to result in a Material Adverse Effect, or (e) Lead Borrower or any of its Restricted Subsidiaries has incurred any obligation in connection with the termination of, or withdrawal from, any Foreign Pension Plan that, in each case, has resulted or would reasonably be expected to result in a Material Adverse Effect; or",erisa
"ERISA. Each Partnership Entity and Operating Subsidiary is in compliance in all material respects with all presently applicable provisions of the Employee Retirement Income Security Act of 1974, as amended, including the regulations and published interpretations thereunder (“ERISA”); no “reportable event” (as defined in ERISA) has occurred with respect to any “pension plan” (as defined in ERISA) for which any Partnership Entity would have any liability, excluding any reportable event for which a waiver could apply; no Partnership Entity expects to incur liability under (i) Title IV of ERISA with respect to termination of, or withdrawal from, any “pension plan” or (ii) Sections 412 or 4971 of the Internal Revenue Code of 1986, as amended, including the regulations and published interpretations thereunder.",erisa
"ERISA. In the event of the occurrence of any ERISA Event that could reasonably be expected to have a Material Adverse Effect, a prompt written notice (but, in any event, within five (5) Business Days of a Relevant Officer of Borrower becoming aware thereof) specifying the nature thereof, what action Borrower, any of its Restricted Subsidiaries or any of their respective ERISA Affiliates has taken, is taking or proposes to take with respect thereto and, when known to any Relevant Officer of Borrower, any action taken or threatened in writing by the Internal Revenue Service, the Department of Labor or the PBGC with respect thereto.",erisa
"ERISA. (i) The Company shall not terminate any plan (“Plan”) of a type described in Section 402l(a) of ERISA in respect of which the Company is an “employer” as defined in Section 3(5) of ERISA so as to result in any material liability to the Pension Benefit Guaranty Corporation (the “PBGC”) established pursuant to Subtitle A of Title IV of ERISA; (ii) engage in or permit any person to engage in any “prohibited transaction” (as defined in Section 406 of ERISA or Section 4975 of the Internal Revenue Code of 1986, as amended) involving any Plan which would subject the Company to any material tax, penalty or other liability; (iii) incur or suffer to exist any material “accumulated funding deficiency” (as defined in Section 302 of ERISA), whether or not waived, involving any Plan; or (iv) allow or suffer to exist any event or condition, which presents a material risk of incurring a material liability to the PBGC by reason of termination of any Plan.",erisa
"ERISA. Be (a) an employee benefit plan subject to Title I of ERISA, (b) a plan or account subject to Section 4975 of the Code, (c) an entity deemed to hold “plan assets” of any such plans or accounts for purposes of ERISA or the Code or (d) a “governmental plan” within the meaning of ERISA.",erisa
"ERISA. The Seller shall not, and shall not cause or permit any of its Affiliates to, cause or permit to occur an event that results in the imposition of a Lien on its interest, if any, in any Transferred Asset under Section 412 of the IRC or Section 303(K) or 4068 of ERISA.",erisa
"ERISA. No steps have been taken by any Person to terminate any Pension Plan the assets of which are not sufficient to satisfy all of its benefit liabilities (as determined under Title IV of ERISA), no contribution failure has occurred with respect to any Pension Plan sufficient to give rise to a lien under Section 302(f) of ERISA, and each Pension Plan has been administered in all material respects in compliance with its terms and applicable provision of ERISA and the Code.",erisa
