clause_text,clause_type
"ERISA. Except as set forth in the Registration Statement, the General Disclosure Package or the Prospectus, neither the Company nor any of its subsidiaries has incurred any liability for any prohibited transaction or accumulated funding deficiency or any complete or partial withdrawal liability with respect to any pension, profit sharing or other plan which is subject to the Employee Retirement Income Security Act of 1974, as amended (“ERISA”), to which the Company or any of its subsidiaries makes or ever has made a contribution and in which any employee of the Company or any such subsidiary is or has ever been a participant, which would, individually or in the aggregate, reasonably be expected to have a Material Adverse Effect. With respect to such plans, each of the Company and its subsidiaries is in compliance in all respects with all applicable provisions of ERISA, except where the failure to so comply would not, individually or in the aggregate, reasonably be expected to have a Material Adverse Effect.",erisa
"ERISA. (a) During the five-year period prior to the date on which this representation is made or deemed made: (i) no ERISA Event has occurred, and, to the best knowledge of the Credit Parties, no event or condition has occurred or exists as a result of which any ERISA Event could reasonably be expected to occur, with respect to any Plan; (ii) no ""accumulated funding deficiency,"" as such term is defined in Section 302 of ERISA and Section 412 of the Code, whether or not waived, has occurred with respect to any Plan; (iii) each Plan has been maintained, operated, and funded in compliance with its own terms and in material compliance with the provisions of ERISA, the Code, and any other applicable federal or state laws; and (iv) no lien in favor of the PBGC or a Plan has arisen or is reasonably likely to arise on account of any Plan.",erisa
"ERISA. Such Borrower and each of its ERISA Affiliates will (a) at all times make prompt payment of all contributions (i) required under all employee pension benefit plans (as defined in Section 3(2) of ERISA) (“Pension Plans”) and (ii) required to meet the minimum funding standard set forth in ERISA with respect to each of its Plans; (b) promptly upon request, furnish the Administrative Agent and the Lenders copies of each annual report/return (Form 5500 Series), as well as all schedules and attachments required to be filed with the Department of Labor and/or the Internal Revenue Service pursuant to ERISA, and the regulations promulgated thereunder, in connection with each of its Pension Plans for each Plan Year (as defined in ERISA); (c) notify the Administrative Agent immediately of any fact, including, but not limited to, any Reportable Event arising in connection with any of its Plans, which might constitute grounds for termination thereof by the PBGC or for the appointment by the appropriate United States District Court of a trustee to administer such Plan, together with a statement, if requested by the Administrative Agent, as to the reason therefor and the action, if any, proposed to be taken in respect thereof; and (d) furnish to the Administrative Agent, upon its request, such additional information concerning any of its Plans as may be reasonably requested. Such Borrower will not nor will it permit any of its ERISA Affiliates to (A) terminate a Plan if any such termination would have a Material Adverse Effect on such Borrower or (B) cause or permit to exist any Reportable Event under ERISA or other event or condition which presents a material risk of termination at the request of the PBGC if such termination would have a Material Adverse Effects.",erisa
"ERISA. None of Borrower, any ERISA Affiliate, or any Plan is or has been in violation of any of the provisions of ERISA, any of the qualification requirements of IRC Section 401(a) or any of the published interpretations thereunder, nor has Borrower or any ERISA Affiliate received any notice to such effect. No notice of intent to terminate a Plan has been filed under Section 4041 of ERISA, nor has any Plan been terminated under ERISA. The PBGC has not instituted proceedings to terminate, or appointed a trustee to administer, a Plan. No lien upon the assets of Borrower has arisen with respect to a Plan. No prohibited transaction or Reportable Event has occurred with respect to a Plan. Neither Borrower nor any ERISA Affiliate has incurred any withdrawal liability with respect to any Multiemployer Plan. Borrower and each ERISA Affiliate have made all contributions required to be made by them to any Plan or Multiemployer Plan when due. There is no accumulated funding deficiency in any Plan, whether or not waived;",erisa
"ERISA. Neither the Company nor any member of the Controlled Group shall permit any Plan maintained by it to (i) engage in any ""prohibited transaction"" (as defined in Section 4975 of the Code, (ii) incur any ""accumulated funding deficiency"" (as defined in Section 302 of ERISA) whether or not waived, or (iii) terminate any Plan in a manner that could result in the imposition of a lien or encumbrance on the assets of the Company or any of its Subsidiaries pursuant to Section 4068 of ERISA.",erisa
"ERISA. With respect to each Plan, the Borrower and all ERISA Affiliates have paid all required minimum contributions and installments on or before the due dates provided under Section 430(j) of the Code and could not reasonably be subject to a lien under Section 430(k) of the Code or Title IV of ERISA. Neither the Borrower nor any ERISA Affiliate has filed, pursuant to Section 412(c) of the Code or Section 302(c) of ERISA, an application for a waiver of the minimum funding standard. No ERISA Event has occurred or is reasonably expected to occur that, when taken together with all other such ERISA Events for which liability is reasonably expected to occur, would reasonably be expected to result in a Material Adverse Effect.",erisa
"ERISA. The Employee Retirement Income Security Act of 1974 and the rules and regulations thereunder, collectively, as the same may from time to time be supplemented or amended and remain in effect.",erisa
"ERISA. (a) The Borrower will furnish to the Administrative Agent promptly following receipt thereof, copies of any documents described in Sections 101(k) or 101(l) of ERISA that any Credit Party or any of its Subsidiaries may request with respect to any Multiemployer Plan to which a Credit Party or any of its Subsidiaries is obligated to contribute; provided that if the Credit Parties or any of their Subsidiaries have not requested such documents or notices from the administrator or sponsor of the applicable Multiemployer Plan, then, upon reasonable request of the Administrative Agent, the Credit Parties shall promptly make a request for such documents or notices from such administrator or sponsor and the Borrower shall provide copies of such documents and notices to the Administrative Agent promptly after receipt thereof; provided, further, that the rights granted to the Administrative Agent in this Section shall be exercised not more than once during a 12-month period, and (b) the Borrower will notify the Administrative Agent promptly following the occurrence of any ERISA Event or Foreign Plan Event that, alone or together with any other ERISA Events or Foreign Plan Events that have occurred, would reasonably be expected to result in liability of any Credit Party that would reasonably be expected to have a Material Adverse Effect.",erisa
ERISA. Each Holder from time to time of the Corporate PIES which is a Plan hereby represents that its acquisition of the Corporate PIES and the holding of the same satisfies the applicable fiduciary requirements of ERISA and that it is entitled to exemption relief from the prohibited transaction provisions of ERISA and the Code in accordance with one or more prohibited transaction exemptions or otherwise will not result in a nonexempt prohibited transaction.,erisa
"ERISA. (i) Promptly after the occurrence thereof with respect to any Plan of any Consolidated Company or any ERISA Affiliate thereof, or any trust established thereunder, notice of (x) a ""reportable event"" described in Section 4043 of ERISA and the regulations issued from time to time thereunder (other than a ""reportable event"" not subject to the provisions for 30-day notice to the PBGC under such regulations), or (y) any other event which could subject any Consolidated Company to any tax, penalty or liability under Title I or Title IV of ERISA or Chapter 43 of the Tax Code, or any tax or penalty resulting from a loss of deduction under Sections 162, 404 or 419 of the Tax Code, where any such taxes, penalties or liabilities exceed or could exceed $1,000,000 in the aggregate;",erisa
"ERISA. With respect to any Plan, and except to the extent that the failure of any of the following statements to be accurate would not result in a material liability to Borrowers: (a) no “accumulated funding deficiency” as defined in Code §412 or ERISA §302 has occurred, whether or not that accumulated funding deficiency has been waived; (b) no Reportable Event has occurred other than events for which reporting has been waived under applicable PBGC regulations; (c) no termination of any plan subject to Title IV of ERISA has occurred; (d) no Borrower nor any Commonly Controlled Entity has incurred a “complete withdrawal” within the meaning of ERISA §4203 from any Multiemployer Plan; (e) no Borrower nor any Commonly Controlled Entity has incurred a “partial withdrawal” within the meaning of ERISA §4205 with respect to any Multiemployer Plan; (f) no Multiemployer Plan to which a Borrower or any Commonly Controlled Entity has an obligation to contribute is in “reorganization” within the meaning of ERISA §4241 nor has notice been received by Borrower or any Commonly Controlled Entity that such a Multiemployer Plan will be placed in “reorganization”.",erisa
"ERISA. Neither any Borrower nor any member of the ERISA Group maintains or contributes to any Plan or Multiemployer Plan, other than those listed on Schedule 5.12. Each Borrower and each member of the ERISA Group have satisfied the minimum funding standards of ERISA and the Internal Revenue Code with respect to each Plan and Multiemployer Plan to which it is obligated to contribute. No ERISA Event has occurred nor has any other event occurred that may result in an ERISA Event that reasonably could be expected to result in a Material Adverse Effect. None of Borrowers, any member of the ERISA Group, or any fiduciary of any Plan is subject to any direct or indirect liability with respect to any Plan that could reasonably be expected to result in a Material Adverse Effect (other than to make regularly scheduled required contributions and to pay Plan benefits in the normal course) under any applicable law, treaty, rule, regulation, or agreement. Neither Borrowers nor any member of the ERISA Group is required to provide security to any Plan under Section 401(a)(29) of the Internal Revenue Code. Each Plan will be able to fulfill its benefit obligations as they come due in accordance with the Plan documents and under GAAP.",erisa
"ERISA. Each Plan complies in all material respects with all applicable requirements of law and regulations, no Reportable Event has occurred with respect to any Plan, neither Borrower nor any other member of the Controlled Group has withdrawn from any Plan or initiated steps to do so, and no steps have been taken to reorganize or terminate any Plan.",erisa
ERISA. 25 SECTION 4.17 Compliance with Law . . . . . . . . . . . . . . . . . . . . . . . . . . . . . . . . . . . . 25 SECTION 4.18 Government Regulation . . . . . . . . . . . . . . . . . . . . . . . . . . . . . . . . . . . 26 SECTION 4.19 Insider . . . . . . . . . . . . . . . . . . . . . . . . . . . . . . . . . . . . . . . . . . 26 SECTION 4.20 Certain Environmental Matters . . . . . . . . . . . . . . . . . . . . . . . . . . . . . . . 26 SECTION 4.21 Insurance:Certifications . . . . . . . . . . . . . . . . . . . . . . . . . . . . . . . . . 27,erisa
"ERISA. (a) No ERISA Event has occurred or is reasonably expected to occur that would reasonably be expected to result in a Material Adverse Effect. Each Plan is in compliance in form and operation with its terms and with the applicable provisions of ERISA, the Code and other applicable law, except for such non-compliance that would not reasonably be expected to have a Material Adverse Effect. Except as would not reasonably be expected to result in a Material Adverse Effect, each Plan (and each related trust, if any) which is intended to be qualified under Section 401(a) of the Code has received a favorable determination letter from the Internal Revenue Service or is in the form of a prototype document that is the subject of a favorable opinion letter.",erisa
"ERISA. If the Borrower has a pension, profit sharing or retirement plan subject to ERISA, such plan has been and will continue to be funded in accordance with its terms and otherwise complies with and continues to comply with the requirements of ERISA.",erisa
"ERISA. The Credit Parties shall not and shall not cause or permit any ERISA Affiliate to, cause or permit to occur an ERISA Event to the extent such ERISA Event could reasonably be expected to have a Material Adverse Effect.",erisa
"ERISA. No Credit Party shall, or shall cause or permit any ERISA Affiliate to, cause or permit to occur (i) an event that could result in the imposition of a Lien under Section 412 of the IRC or Section 302 or 4068 of ERISA or (ii) an ERISA Event to the extent such ERISA Event would reasonably be expected to result in taxes, penalties and other liabilities in an aggregate amount in excess of $250,000 in the aggregate.",erisa
"ERISA. (a) Schedule 4.16 (ERISA Matters) separately identifies as of the date hereof all Title IV Plans, all Multiemployer Plans and all of the employee benefit plans within the meaning of Section 3(3) of ERISA to which any Warnaco Entity has any obligation or liability, contingent or otherwise.",erisa
"ERISA. The assets used in the Transaction (1) are not assets of any “plan” (as such term is defined in Section 4975 of the U.S. Internal Revenue Code (the “Code”)) subject to Section 4975 of the Code or any “employee benefit plan” (as such term is defined in Section 3(3) of the U.S. Employee Retirement Income Security Act of 1974, as amended (“ERISA”)) subject to Title I of ERISA, and (2) do not constitute “plan assets” within the meaning of Department of Labor Regulation 2510.3-101, 29 CFR Section 2510-3-101.",erisa
"ERISA. It continuously represents that it is not (i) an employee benefit plan (an “ERISA Plan”) as defined in Section 3(3) of the Employee Retirement Income Security Act of 1974, as amended (“ERISA”), subject to Title 1 of ERISA or Section 4975 of the Internal Revenue Code of 1986, as amended, (ii) a person or entity acting on behalf of an ERISA Plan or (iii) a person or entity the assets of which constitute assets of an ERISA Plan.” It will provide notice to the other party in the event that it is aware that it is in breach of any aspect of this representation or is aware that with the passing of time, giving of notice or expiry of any applicable grace period, it will breach this representation.",erisa
"ERISA. The Company does not maintain or contribute to, or have any obligation under, any Pension Plan. The Company is in compliance in all material respects with the presently applicable provisions of ERISA and the United States Internal Revenue Code of 1986, as amended, with respect to each Pension Plan except in any such case for any such matters that, individually or in the aggregate, have not had, and would not reasonably be expected to have, a Material Adverse Effect.",erisa
"ERISA. The Borrower or any member of the Controlled Group shall fail to pay when due any material amount which it shall have become liable to pay to the PBGC or to a Plan under Title IV of ERISA; or notice of intent to terminate a Plan or Plans shall be filed under Title IV of ERISA by the Borrower, any member of the Controlled Group, any plan administrator or any combination of the foregoing; or the PBGC shall institute proceedings under Title IV of ERISA to terminate or to cause a trustee to be appointed to administer any such Plan or Plans or a proceeding shall be instituted by a fiduciary of any such Plan or Plans to enforce Section 515 or 4219(c)(5) of ERISA and such proceeding shall not have been dismissed within thirty (30) days thereafter; or a condition shall exist by reason of which the PBGC would be entitled to obtain a decree adjudicating that any such Plan or Plans must be terminated; or",erisa
"ERISA. If (i) any Plan subject to Title IV of ERISA shall fail to satisfy the minimum funding standards of ERISA or the Code for any plan year or part thereof or a waiver of such standards or extension of any amortization period is sought or granted under section 412 of the Code, (ii) a notice of intent to terminate any Plan shall have been or is reasonably expected to be filed with the PBGC or the PBGC shall have instituted proceedings under ERISA section 4042 to terminate or appoint a trustee to administer any Plan subject to Title IV of ERISA or the PBGC shall have notified the Company or any ERISA Affiliate that a Plan may become a subject of any such proceedings, (iii) the aggregate “amount of unfunded benefit liabilities” (within the meaning of section 4001(a)(18) of ERISA) under all Plans, determined in accordance with Title IV of ERISA, shall exceed the aggregate current value of the assets under all Plans, (iv) the Company or any ERISA Affiliate shall have incurred or is reasonably expected to incur any liability pursuant to Title I or IV of ERISA or the penalty or excise tax provisions of the Code relating to employee benefit plans, (v) the Company or any ERISA Affiliate withdraws from any Multiemployer Plan, or (vi) the Company establishes or amends any employee welfare benefit plan that provides post-employment welfare benefits in a manner that would increase the liability of the Company thereunder; and any such event or events described in clauses (i) through (vi) above, either individually or together with any other such event or events, could reasonably be expected to have a Material Adverse Effect. As used in Section 11.7 the terms “employee benefit plan” and “employee welfare benefit plan” shall have the respective meanings assigned to such terms in Section 3 of ERISA.",erisa
"ERISA. ERISA"" means the Employee Retirement Income Security Act of 1974, as amended from time to time.",erisa
"ERISA. Promptly, and in any event within 10 days after the Borrower, any Subsidiary of the Borrower or any ERISA Affiliate knows of the occurrence of any of the following, the Borrower will deliver to each of the Lenders a certificate on behalf of the Borrower of an Authorized Officer of the Borrower setting forth the full details as to such occurrence and the action, if any, that the Borrower, such Subsidiary or such ERISA Affiliate is required or proposes to take, together with any notices required or proposed to be given to or filed with or by the Borrower, the Subsidiary, the ERISA Affiliate, the PBGC, a Plan participant or the Plan administrator with respect thereto:",erisa
"ERISA. “ERISA” means the federal Employee Retirement Income Security Act of 1974 and any successor statute, and the rules and regulations thereunder, and, in the case of any referenced section thereof, any successor section thereto, collectively and as from time to time amended and in effect.",erisa
"ERISA. The Seller is not and is not acting on behalf of an ""employee benefit plan"" within the meaning of Section 3(3) of the Employee Retirement Income Security Act of 1974, as amended (""ERISA""), a ""plan"" within the meaning of Section 4975 of the Internal Revenue Code of 1986, as amended (the ""Code""), or an entity deemed to hold ""plan assets"" within the meaning of 29 C.F.R. Section 2510.3-101 of any such employee benefit plan or plans.",erisa
ERISA. No ERISA Event has occurred or is reasonably expected to occur that would reasonably be expected to result in a Material Adverse Effect.,erisa
"ERISA. Each employee benefit plan, as defined by the Employee Retirement Income Security Act of 1974, as amended (“ERISA”), maintained by The Goldfield Corporation or by any subsidiary of the Borrower or Guarantor(s) meets, as of the date hereof the minimum funding standards of Section 302 of ERISA, all applicable requirements of ERISA and of the Internal Revenue Code of 1986, as amended, and no “Reportable Event” nor “Prohibited Transaction” (as defined by ERISA) has occurred with respect to any such plan.",erisa
"ERISA. By its acquisition of the Securities or beneficial interests therein, the purchaser or transferee of such Securities or beneficial interests is deemed to represent, that on each day from the date of acquisition through and including the date of disposition either that (a) it is not and is not acting directly or indirectly on behalf of, and for so long as it holds the Securities will not be acting directly or indirectly on behalf of, a (i) an “employee benefit plan” as defined in and subject to Title I of the U.S. Employee Retirement Income Security Act of 1974, as amended (“ERISA”), (ii) a plan, account or other arrangement subject to Section 4975 of the U.S. Internal Revenue Code of 1986, as amended (the “Code”), (iii) any plan (such as a governmental plan (as defined in Section 3(32) of ERISA), a non-U.S. plan (as described in Section 4(b)(4) of ERISA) and certain church plans (as defined in Section 3(33) of ERISA and that have made no election under Section 410(d) of the Code)), account or arrangement that, while not subject to Title I of ERISA or Section 4975 of the Code, is subject to substantially similar provisions of any U.S. federal, state or local law, or non-U.S. law (“Similar Law”) or (iv) any entity whose underlying assets include, or are deemed for the purposes of ERISA, the Code or any Similar Law to include, plan assets of any such employee benefit plan or other plan, account or arrangement, each as described in (i), (ii) or (iii) (each of the foregoing, a “Plan”), and no portion of the assets used to acquire the Securities constitutes plan assets of any Plan or (b) its acquisition, holding and disposition of such Securities will not constitute or result in a non-exempt prohibited transaction under Section 406 of ERISA or Section 4975 of the Code or a violation under any applicable Similar Law. Any such representation or deemed representation may be evidenced by a representation or deemed representation contained in a legend on the Securities in the form approved by the Company.",erisa
"ERISA. Borrower shall not: (a) engage in or permit any transaction which could result in a “prohibited transaction” (as such term is defined in Section 406 of ERISA) or in the imposition of an excise tax pursuant to Section 4975 of the Code with respect to any Borrower Benefit Plan; (b) engage in or permit any transaction or other event which could result in a “reportable event” (as such term is defined in Section 4043 of ERISA) for any Borrower Pension Plan; (c) fail to make full payment when due of all amounts which, under the provisions of any Borrower Benefit Plan, Borrower is required to pay as contributions thereto; (d) permit to exist any “accumulated funding deficiency” (as such term is defined in Section 302 of ERISA) as of the end of any Fiscal Year, in excess of five percent (5.0%) of net worth (determined in accordance with GAAP) of Borrower and its Consolidated Subsidiaries, whether or not waived, with respect to any Borrower Pension Plan; (e) fail to make any payments to any Multiemployer Plan that Borrower may be required to make under any agreement relating to such Multiemployer Plan or any law pertaining thereto; or (f) terminate any Borrower Pension Plan in a manner which could result in the imposition of a lien on any property of Borrower pursuant to Section 4068 of ERISA. Borrower shall not terminate any Borrower Pension Plan so as to result in any liability to the PBGC.",erisa
