clause_text,clause_type
"ERISA. (i) An ERISA Event shall occur with respect to a Pension Plan or Multiemployer Plan which has resulted or could reasonably be expected to result in liability of the Borrower under Title IV of ERISA to the Pension Plan, Multiemployer Plan or the PBGC in an aggregate amount in excess of $500,000.00; (ii) the aggregate amount of Unfunded Pension Liability among all Pension Plans at any time exceeds $500,000.00; or (iii) the Borrower or any ERISA Affiliate shall fail to pay when due, any installment payment with respect to its withdrawal liability under Section 4201 of ERISA under a Multiemployer Plan in an aggregate amount in excess of $500,000.00, or the aggregate of (i), (ii) and (iii) exceeds $1,000,000.00; or",erisa
"ERISA. The Borrower has never established or maintained any funded employee pension benefit plan as defined under Section 3(2)(A) of the Employee Retirement Income Security Act of 1974, as amended and in effect on the date hereof (""ERISA""), other than the plans described on the Disclosure Schedule. No employee benefit plan established or maintained, or to which contributions have been made, by the Borrower or any Subsidiary of the Borrower that is subject to Part 3 of Title I-B of ERISA, had an accumulated funding deficiency (as such term is defined in Section 302 of ERISA) as of the last day of the fiscal year of such plan ended most recently prior to the date hereof, or would have had an accumulated funding deficiency (as so defined) on such day if such year were the first year of the plan to which Part 3 of Title I-B of ERISA applied. No material liability to the Pension Benefit Guaranty Corporation has been incurred or is expected by the Borrower to be incurred by it or any Subsidiary of the Borrower with respect to any such plan or otherwise. The execution, delivery and performance of this Agreement and the other Loan Documents will not involve on the part of the Borrower any prohibited transaction within the meaning of ERISA or Section 4975 of the Internal Revenue Code. The Borrower has never maintained, contributed to or been obligated to contribute to any ""multiemployer plan,"" as defined in Section 3(37) of ERISA. The Borrower has never incurred any ""withdrawal liability"" calculated under Section 4211 of ERISA, and there has been no event or circumstance that would cause it to incur any such liability.",erisa
"ERISA. Except where noncompliance could not reasonably be expected to have a Material Adverse Effect, each member of the Controlled Group has fulfilled its obligations under the minimum funding standards of ERISA and the Code with respect to each Single Employer Plan. Each member of the Controlled Group is in compliance with the applicable provisions of ERISA and the Code with respect to each Plan except where such non-compliance would not have a Material Adverse Effect. Except as could not reasonably be expected to have a Material Adverse Effect, each Single Employer Plan complies in all respects with all applicable requirements of law and regulations, no Reportable Event which has or may result in any liability has occurred with respect to any Single Employer Plan, and no steps have been taken to terminate any Single Employer Plan. No member of the Controlled Group has (i) sought a waiver of the minimum funding standard under Section 412 of the Code in respect of any Plan, (ii) failed to make any contribution or payment to any Single Employer Plan or Multiemployer Plan, or made any amendment to any Plan, which has resulted or could reasonably be expected to result in the imposition of a Lien or the posting of a bond or other security under ERISA or the Code having a value individually or collectively in excess of $50,000,000 or (iii) incurred any actual liability under Title IV of ERISA that could reasonably be expected to have a Material Adverse Effect, other than a liability to the PBGC for premiums under Section 4007 of ERISA or a liability that has been satisfied.",erisa
"ERISA. (a) Any Plan shall fail to satisfy the minimum funding standard required for any plan year or part thereof or a waiver of such standard or extension of any amortization period is sought or granted under Section 412 of the Code; any Plan is or shall have been terminated or is the subject of termination proceedings under ERISA (including the giving of written notice thereof); an event shall have occurred or a condition shall exist in either case entitling the PBGC to terminate any Plan or to appoint a trustee to administer any Plan (including the giving of written notice thereof); any Plan shall have an accumulated funding deficiency (whether or not waived); the Borrower or any ERISA Affiliate has incurred or is likely to incur a liability to or on account of a Plan under Section 409, 502(i), 502(1), 515, 4062, 4063, 4064, 4069, 4201 or 4204 of ERISA or Section 4971 or 4975 of the Code (including the giving of written notice thereof); (b) there could result from any event or events set forth in clause (a) of this Section 11.6 the imposition of a lien, the granting of a security interest, or a liability, or the reasonable likelihood of incurring a lien, security interest or liability; and (c) such lien, security interest or liability will or would be reasonably likely to have a Material Adverse Effect; or",erisa
"ERISA. The Employee Retirement Income Security Act of 1974, as amended.",erisa
"ERISA. Except as set forth on Schedule 6.01(i), (i) each Employee Plan is in substantial compliance with ERISA and the Internal Revenue Code, (ii) no Termination Event has occurred nor is reasonably expected to occur with respect to any Employee Plan, (iii) the most recent annual report (Form 5500 Series) with respect to each Employee Plan, including any required Schedule B (Actuarial Information) thereto, copies of which have been filed with the Internal Revenue Service and delivered to the Agents, is complete and correct and fairly presents the funding status of such Employee Plan, and since the date of such report there has been no material adverse change in such funding status, (iv) copies of each agreement entered into with the PBGC, the U.S. Department of Labor or the Internal Revenue Service with respect to any Employee Plan have been delivered to the Agents, (v) no Employee Plan had an accumulated or waived funding deficiency or permitted decrease which would create a deficiency in its funding standard account or has applied for an extension of any amortization period within the meaning of Section 412 of the Internal Revenue Code at any time during the previous 60 months, and (vi) no Lien imposed under the Internal Revenue Code or ERISA exists or is likely to arise on account of any Employee Plan within the meaning of Section 412 of the Internal Revenue Code. Except as set forth on Schedule 6.01(i), no Loan Party or any of its ERISA Affiliates has incurred any withdrawal liability under ERISA with respect to any Multiemployer Plan, or is aware of any facts indicating that it or any of its ERISA Affiliates may in the future incur any such withdrawal liability. No Loan Party or any of its ERISA Affiliates nor any fiduciary of any Employee Plan has (i) engaged in a nonexempt prohibited transaction described in Sections 406 of ERISA or 4975 of the Internal Revenue Code, (ii) failed to pay any required installment or other payment required under Section 412 of the Internal Revenue Code on or before the due date for such required installment or payment, (iii) engaged in a transaction within the meaning of Section 4069 of ERISA or (iv) incurred any liability to the PBGC which remains outstanding other than the payment of premiums, and there are no premium payments which have become due which are unpaid. There are no pending or, to the best knowledge of any Loan Party, threatened claims, actions, proceedings or lawsuits (other than claims for benefits in the norm...",erisa
"ERISA. The term ""ERISA"" shall mean the Employee Retirement Income Security Act of 1974, as amended.",erisa
"ERISA. No accumulated funding deficiency (as defined in section 302 of ERISA and section 412 of the Code), whether or not waived, exists with respect to any Plan (other than a Multiemployer Plan). No liability to the PBGC has been or is expected by the Company or any ERISA Affiliate to be incurred with respect to any Plan (other than a Multiemployer Plan) by the Company, any Subsidiary or any ERISA Affiliate which is or would be materially adverse to the business, property or assets, condition (financial or otherwise) or operations of the Company and its Subsidiaries taken as a whole. Neither the Company, any Subsidiary nor any ERISA Affiliate has incurred or presently expects to incur any withdrawal liability under Title IV of ERISA with respect to any Multiemployer Plan which is or would be materially adverse to the business, property or assets, condition (financial or otherwise) or operations of the Company and its Subsidiaries taken as a whole. The execution and delivery of this Agreement and the issuance and sale of the Notes will be exempt from or will not involve any transaction which is subject to the prohibitions of section 406 of ERISA and will not involve any transaction in connection with which a penalty could be imposed under section 502(i) of ERISA or a tax could be imposed pursuant to section 4975 of the Code. The representation by the Company in the next preceding sentence is made in reliance upon and subject to the accuracy of the representation of each Purchaser in paragraph 9B as to the source of funds to be used by it to purchase any Notes.",erisa
"ERISA. The Company is not a party to an “employee benefit plan,” as defined in Section 3(3) of the Employee Retirement Income Security Act of 1974, as amended (“ERISA”), which: (i) is subject to any provision of ERISA and (ii) is or was at any time maintained, administered or contributed to by the Company or any of its ERISA Affiliates (as defined hereafter). These plans are referred to collectively herein as the “Employee Plans.” An “ERISA Affiliate” of any person or entity means any other person or entity which, together with that person or entity, could be treated as a single employer under Section 414(b), (c), (m) or (o) of the Internal Revenue Code of 1986, as amended (the “Code”). Each Employee Plan has been maintained in material compliance with its terms and the requirements of applicable law. No Employee Plan is subject to Title IV of ERISA. The Registration Statement, Preliminary Prospectus and the Prospectus identify each employment, severance or other similar agreement, arrangement or policy and each material plan or arrangement required to be disclosed pursuant to the Rules and Regulations providing for insurance coverage (including any self-insured arrangements), workers’ compensation, disability benefits, severance benefits, supplemental unemployment benefits, vacation benefits or retirement benefits, or deferred compensation, profit-sharing, bonuses, stock options, stock appreciation rights or other forms of incentive compensation, or post-retirement insurance, compensation or benefits, which: (i) is not an Employee Plan; (ii) is entered into, maintained or contributed to, as the case may be, by the Company or any of its ERISA Affiliates; and (iii) covers any officer or director or former officer or director of the Company or any of its ERISA Affiliates. These agreements, arrangements, policies or plans are referred to collectively as “Benefit Arrangements.” Each Benefit Arrangement has been maintained in material compliance with its terms and with the requirements of applicable law. Except as disclosed in the Registration Statement, Preliminary Prospectus and the Prospectus, there is no liability in respect of post-retirement health and medical benefits for retired employees of the Company or any of its ERISA Affiliates, other than medical benefits required to be continued under applicable law. No “prohibited transaction” (as defined in either Section 406 of ERISA or Section 4975 of the Code) has occurred with respect to any Employee Plan; and ea...",erisa
"ERISA. The Employee Retirement Income Security Act of 1974, as amended and in effect from time to time.",erisa
"ERISA. A Reportable Event shall occur which Lender, in its sole discretion, shall determine in good faith constitutes grounds for the termination by the Pension Benefit Guaranty Corporation of any Plan or for the appointment by the appropriate United States district court of a trustee for any Plan, or if any Plan shall be terminated or any such trustee shall be requested or appointed, or if Borrower, any Subsidiary of Borrower or any Guarantor is in ""default"" (as defined in Section 4219(c)(5) of ERISA) with respect to payments to a Multiemployer Plan resulting from Borrower's, such Subsidiary's or such Guarantor's complete or partial withdrawal from such Plan.",erisa
"ERISA. The Borrower shall not, and shall not permit any of its ERISA Affiliates to: (a) engage in a prohibited transaction or violation of the fiduciary responsibility rules with respect to any Plan which has resulted or could reasonably be expected to result in liability of the Borrower in an aggregate amount in excess of $25,000,000; or (b) engage in a transaction which could reasonably be expected to result in liability to the Borrower or any ERISA Affiliate in excess of $25,000,000 pursuant to Section 4069 or 4212(c) of ERISA.",erisa
"ERISA. Each Plan is in substantial compliance in form and operation with its terms and with ERISA and the Code (including, without limitation, the Code provisions compliance with which is necessary for any intended favorable tax treatment) and all other applicable laws and regulations. Each Plan (and each related trust, if any) which is intended to be qualified under Section 401(a) of the Code has received a favorable determination letter from the Internal Revenue Service to the effect that it meets the requirements of Sections 401(a) and 501(a) of the Code covering all applicable tax law changes, or is comprised of a master or prototype plan that has received a favorable opinion letter from the Internal Revenue Service, and nothing has occurred since the date of such determination that would adversely affect such determination (or, in the case of a Plan with no determination, nothing has occurred that would adversely affect the issuance of a favorable determination letter or otherwise adversely affect such qualification). No ERISA Event has occurred or is reasonably expected to occur. There exists no Unfunded Pension Liability with respect to any Plan. None of the Borrower, any of its Subsidiaries or any ERISA Affiliate is making or accruing an obligation to make contributions, or has, within any of the five calendar years immediately preceding the date this assurance is given or deemed given, made or accrued an obligation to make, contributions to any Multiemployer Plan. There are no actions, suits or claims pending against or involving a Plan (other than routine claims for benefits) or, to the knowledge of the Borrower, any of its Subsidiaries or any ERISA Affiliate, threatened, which would reasonably be expected to be asserted successfully against any Plan and, if so asserted successfully, would reasonably be expected either singly or in the aggregate to result in liability to the Borrower or any of its Subsidiaries. The Borrower, each of its Subsidiaries and each ERISA Affiliate have made all contributions to or under each Plan and Multiemployer Plan required by law within the applicable time limits prescribed thereby, by the terms of such Plan or Multiemployer Plan, respectively, or by any contract or agreement requiring contributions to a Plan or Multiemployer Plan. No Plan which is subject to Section 412 of the Code or Section 302 of ERISA has applied for or received an extension of any amortization period within the meaning of Section 412 of the Code or ...",erisa
"ERISA. The word ""ERISA"" means the Employee Retirement Income Security Act of 1974, as amended.",erisa
"ERISA. So long as the Seller or the Issuer are ERISA Affiliates of the Servicer, the Servicer shall comply in all material respects with the provisions of ERISA, the Code, and all other applicable laws, except where such non-compliance could not reasonably be expected to result in a material adverse effect with respect to the Servicer and its ERISA Affiliates or with respect to the Trust Property. Without limiting the foregoing, the Servicer shall not, and shall not permit its ERISA Affiliates to: (i) engage in any non-exempt prohibited transaction (within the meaning of the Internal Revenue Code Section 4975 or ERISA Section 406) with respect to any Benefit Plan for which the Servicer or its ERISA Affiliates would have a material liability; (ii) fail to satisfy the minimum funding standards under Section 302(a) of ERISA and Section 412(a) of the Internal Revenue Code with respect to any Benefit Plan or, in the case of a Multiemployer Plan, have an accumulated funding deficiency within the meaning of Section 304 of ERISA or Section 431 of the Code by an amount exceeding $500,000 or (iii) terminate any Benefit Plan or Multiemployer Plan if such termination would result in any material liability for which the Seller or Issuer would be liable as ERISA Affiliates.",erisa
"ERISA. Neither a Reportable Event nor a failure to meet the minimum funding standards (within the meaning of Section 302 of ERISA), whether or not waived, has occurred during the five-year period prior to the date on which this representation is made or deemed made with respect to any Plan other than a Multiemployer Plan, and each Plan has complied in all respects with the applicable provisions of ERISA and the Code, where the liability could be reasonably expected to result in a Material Adverse Effect; provided, however, that with respect to any Multiemployer Plan, such representation is made only to the knowledge of the Borrower. No termination of a Single Employer Plan pursuant to Section 4041(c) or 4042 of ERISA has occurred, and no Lien in favor of the PBGC or a Plan has arisen, during such five-year period. There has been no determination that any Single Employer Plan is, or is reasonably expected to be, in “at risk” status (within the meaning of Section 430 of the Code or Section 303 of ERISA). Neither the Borrower nor any Commonly Controlled Entity has had a complete or partial withdrawal from any Multiemployer Plan that has resulted in liability and to the knowledge of the Borrower, neither the Borrower nor any Commonly Controlled Entity would become subject to any liability under ERISA if the Borrower or any such Commonly Controlled Entity were to withdraw completely from all Multiemployer Plans as of the valuation date most closely preceding the date on which this representation is made or deemed made which liability could be reasonably expected to result in a Material Adverse Effect. To the Borrower’s knowledge, no Multiemployer Plan is in Insolvency or in “endangered” or “critical” status (within the meaning of Section 432 of the Code or Section 305 of ERISA).",erisa
ERISA. Except as would not result or be reasonably expected to result in a Material Adverse Effect:,erisa
"ERISA. No Credit Party shall, or shall cause or permit any ERISA Affiliate to, cause or permit to occur an event that could result in the imposition of a Lien under Section 412 of the IRC or Section 302 or 4068 of ERISA or cause or permit to occur an ERISA Event to the extent such ERISA Event could reasonably be expected to have a Material Adverse Effect.",erisa
ERISA. The Employee Retirement Income Security Act of 1974.,erisa
"ERISA. (i) Any ERISA Event shall have occurred that results or could reasonably be expected to result in liability to any member of the ERISA Group aggregating in excess of $10,000,000; or",erisa
"ERISA. (i) Each Benefit Arrangement is in compliance with the applicable provisions of ERISA, the Internal Revenue Code and other Applicable Laws in all material respects. Except with respect to Multiemployer Plans, each Qualified Plan (A) has received a favorable determination from the Internal Revenue Service applicable to such Qualified Plan’s current remedial amendment cycle (as defined in Revenue Procedure 2007-44 or “2007-44” for short), (B) has timely filed for a favorable determination letter from the Internal Revenue Service during its staggered remedial amendment cycle (as defined in 2007-44) and such application is currently being processed by the Internal Revenue Service, (C) had filed for a determination letter prior to its “GUST remedial amendment period” (as defined in 2007-44) and received such determination letter and the staggered remedial amendment cycle first following the GUST remedial amendment period for such Qualified Plan has not yet expired, or (D) is maintained under a prototype plan and may rely upon a favorable opinion letter issued by the Internal Revenue Service with respect to such prototype plan. To the best knowledge of the Borrower, nothing has occurred which would cause the loss of its reliance on each Qualified Plan’s favorable determination letter or opinion letter.",erisa
"ERISA. Borrower shall deliver to Lender as soon as possible, and in any event within ten days after Borrower knows or has reason to believe that any of the events or conditions specified below with respect to any Plan or Multiemployer Plan has occurred or exists, an Officer’s Certificate setting forth details respecting such event or condition and the action, if any, that Borrower or its ERISA Affiliate proposes to take with respect thereto (and a copy of any report or notice required to be filed with or given to PBGC by Borrower or an ERISA Affiliate with respect to such event or condition):",erisa
"ERISA. (a) (i) As soon as practicable and in any event within ten (10) days after the Borrower or any of its Subsidiaries or ERISA Affiliates knows or has reason to know that a Reportable Event has occurred with respect to any Plan, deliver, or cause such Subsidiary or ERISA Affiliate to deliver, to the Administrative Agent a certificate of a Responsible Officer of the Borrower or such Subsidiary or ERISA Affiliate, as the case may be, setting forth the details of such Reportable Event and the action, if any, which the Borrower or such Subsidiary or ERISA Affiliate is required or proposes to take, together with any notices required or proposed to be given; (ii) upon the request of any Lender made from time to time, deliver, or cause each Subsidiary or ERISA Affiliate to deliver, to each Lender a copy of the most recent actuarial report and annual report completed with respect to any Plan; (iii) as soon as possible and in any event within ten (10) days after the Borrower or any of its Subsidiaries or ERISA Affiliates knows or has reason to know that any of the following have occurred or is reasonably likely to occur with respect to any Plan: (A) such Plan has been terminated, reorganized, petitioned or declared insolvent under Title IV of ERISA, (B) the Plan Sponsor intends to terminate such Plan under Section 4041(b) or (c), (C) the PBGC has instituted or will institute proceedings under Section 515 of ERISA to collect a delinquent contribution to such Plan or under Section 4042 of ERISA to terminate such Plan, (D) that an accumulated funding deficiency has been incurred or that an application has been made to the Secretary of the Treasury for a waiver or modification of the minimum funding standard (including any required installment payments) or an extension of any amortization period under Section 412 of the Code, or (E) that the Borrower, or any Subsidiary of the Borrower or any ERISA Affiliate will incur any material liability (including, but not limited to, contingent or secondary liability) to or on account of the termination of or withdrawal from a Plan under Section 401(a)(29), 4971 or 4975 of the Code or Section 409 or 502(1) of ERISA, deliver, or cause such Subsidiary or ERISA Affiliate to deliver, to the Administrative Agent a written notice thereof; and (iv) as soon as possible and in any event within thirty (30) days after the Borrower or any of its Subsidiaries or ERISA Affiliates knows or has reason to know that any of them has caused a complete w...",erisa
"ERISA. (i) As of the Closing Date, neither the Borrower nor any ERISA Affiliate maintains or contributes to, or has any obligation under, any Employee Benefit Plans other than those identified on Schedule 7.1(i);",erisa
"ERISA. Based upon the Employee Retirement Income Security Act of 1974 (“ERISA”), and the regulations and published interpretations thereunder: (i) neither it nor any of its Subsidiaries has engaged in any Prohibited Transactions (as defined in Section 406 of ERISA and Section 4975 of the Code); (ii) it and each of its Subsidiaries has met all applicable minimum funding requirements under Section 302 of ERISA in respect of its plans; (iii) neither it nor any of its Subsidiaries has any knowledge of any event or occurrence which would cause the Pension Benefit Guaranty Corporation to institute proceedings under Title IV of ERISA to terminate any employee benefit plan(s); (iv) neither it nor any of its Subsidiaries has any fiduciary responsibility for investments with respect to any plan existing for the benefit of persons other than its or such Subsidiary’s employees; and (v) neither it nor any of its Subsidiaries has withdrawn, completely or partially, from any multi-employer pension plan so as to incur liability under the Multiemployer Pension Plan Amendments Act of 1980.",erisa
