clause_text,clause_type
"ERISA. (i) An ERISA Event occurs with respect to a Pension Plan or Multiemployer Plan which has resulted or could reasonably be expected to result in liability of the Borrower under Title IV of ERISA to the Pension Plan, Multiemployer Plan or the PBGC in an aggregate amount in excess of the Threshold Amount, or (ii) the Borrower or any ERISA Affiliate fails to pay when due, after the expiration of any applicable grace period, any installment payment with respect to its withdrawal liability under Section 4201 of ERISA under a Multiemployer Plan in an aggregate amount in excess of the Threshold Amount; or",erisa
"ERISA. No ERISA Event has occurred or is reasonably expected to occur that, when taken together with all other such ERISA Events for which liability is reasonably expected to occur, could reasonably be expected to result in a Material Adverse Effect.",erisa
"ERISA. Neither a Reportable Event nor an “accumulated funding deficiency” (within the meaning of Section 412 of the Code or Section 302 of ERISA) has occurred during the five-year period prior to the date on which this representation is made or deemed made with respect to any Plan, and each Plan has complied in all material respects with the applicable provisions of ERISA and the Code. No termination of a Single Employer Plan has occurred, and no Lien in favor of the PBGC or a Plan has arisen, during such five-year period. The present value of all accrued benefits under each Single Employer Plan (based on those assumptions used to fund such Plans) did not, as of the last annual valuation date prior to the date on which this representation is made or deemed made, exceed the value of the assets of such Plan allocable to such accrued benefits by a material amount. Neither the Borrower nor any Commonly Controlled Entity has had a complete or partial withdrawal from any Multiemployer Plan that has resulted or could reasonably be expected to result in a material liability under ERISA, and neither the Borrower nor any Commonly Controlled Entity would become subject to any material liability under ERISA if the Borrower or any such Commonly Controlled Entity were to withdraw completely from all Multiemployer Plans as of the valuation date most closely preceding the date on which this representation is made or deemed made. No such Multiemployer Plan is in Reorganization or Insolvent.",erisa
"ERISA. No ERISA Event has occurred or is reasonably expected to occur that, when taken together with all other such ERISA Events for which liability is reasonably expected to occur, could reasonably be expected to result in a Material Adverse Effect. The present value of all accumulated benefit obligations under each Plan (based on the assumptions used for purposes of Statement of Financial Accounting Standards No. 87) did not, as of the date of the most recent financial statements reflecting such amounts, exceed by more than $10,000,000 the fair market value of the assets of such Plan, and the present value of all accumulated benefit obligations of all underfunded Plans (based on the assumptions used for purposes of Statement of Financial Accounting Standards No. 87) did not, as of the date of the most recent financial statements reflecting such amounts, exceed by more than $10,000,000 the fair market value of the assets of all such underfunded Plans.",erisa
"ERISA. No ERISA Event has occurred or is reasonably expected to occur that, when taken together with all other such ERISA Events for which liability is reasonably expected to occur, could reasonably be expected to result in a Material Adverse Effect. The present value of all accumulated benefit obligations under each Plan (based on the assumptions used for purposes of Statement of Financial Accounting Standards No. 87) did not, as of the date of the most recent financial statements reflecting such amounts, exceed the fair market value of the assets of such Plan.",erisa
"ERISA. To the knowledge of the Company, each material employee benefit plan, within the meaning of Section 3(3) of the Employee Retirement Income Security Act of 1974, as amended (“ERISA”), that is maintained, administered or contributed to by the Company or any of its affiliates for employees or former employees of the Company and any of its Subsidiaries has been maintained in material compliance with its terms and the requirements of any applicable statutes, orders, rules and regulations, including but not limited to ERISA and the Internal Revenue Code of 1986, as amended (the “Code”); no prohibited transaction, within the meaning of Section 406 of ERISA or Section 4975 of the Code, has occurred which would result in a material liability to the Company with respect to any such plan excluding transactions effected pursuant to a statutory or administrative exemption; and for each such plan that is subject to the funding rules of Section 412 of the Code or Section 302 of ERISA, no “accumulated funding deficiency” as defined in Section 412 of the Code has been incurred, whether or not waived, and the fair market value of the assets of each such plan (excluding for these purposes accrued but unpaid contributions) exceeds the present value of all benefits accrued under such plan determined using reasonable actuarial assumptions.",erisa
"ERISA. (a) Borrower shall not engage in any transaction which would cause any obligation, or action taken or to be taken, hereunder (or the exercise by Lender of any of its rights under the Note, this Agreement or the other Loan Documents) to be a non-exempt (under a statutory or administrative class exemption) prohibited transaction under ERISA.",erisa
"ERISA. Upon the Borrower or any ERISA Affiliate obtaining knowledge thereof, the Borrower will give written notice to the Administrative Agent promptly (and in any event within ten days) of any of the following which would result in or reasonably would be expected to result in a Material Adverse Effect: (i) any event or condition, including, but not limited to, any Reportable Event, that constitutes, or would be reasonably expected to lead to, an ERISA Event; (ii) with respect to any Multiemployer Plan, the receipt of notice as prescribed in ERISA or otherwise of any withdrawal liability assessed against the Borrower or any of its ERISA Affiliates, or of a determination that any Multiemployer Plan is in reorganization or insolvent (both within the meaning of Title IV of ERISA); (iii) the failure to make full payment on or before the due date (including extensions) thereof of all amounts which the Borrower or any of its Subsidiaries or ERISA Affiliates is required to contribute to each Plan pursuant to its terms and as required to meet the minimum funding standard set forth in ERISA and the Code with respect thereto; or (iv) a change in the funding status of any Plan, in each case together with a description of any such event or condition or a copy of any such notice and a statement by an officer of the Borrower briefly setting forth the details regarding such event, condition, or notice, and the action, if any, which has been or is being taken or is proposed to be taken with respect thereto. Promptly upon request, the Borrower shall furnish the Lenders with such additional information concerning any Plan as may be reasonably requested, including, but not limited to, copies of each annual report/return (Form 5500 series), as well as all schedules and attachments thereto required to be filed with the Department of Labor and/or the Internal Revenue Service pursuant to ERISA and the Code, respectively, for each “plan year” (within the meaning of Section 3(39) of ERISA).",erisa
"ERISA. The Company is in compliance in all material respects with all presently applicable provisions of the Employee Retirement Income Security Act of 1974, as amended, including the regulations and published interpretations thereunder (“ERISA”); no “reportable event” (as defined in ERISA) has occurred with respect to any “pension plan” (as defined in ERISA) for which the Company would have any liability; the Company has not incurred and does not expect to incur liability under (i) Title IV of ERISA with respect to termination of, or withdrawal from, any “pension plan” or (ii) Sections 412 or 4971 of the Internal Revenue Code of 1986, as amended, including the regulations and published interpretations thereunder (the “Code”); and each “pension plan” for which the Company would have any liability that is intended to be qualified under Section 401(a) of the Code is so qualified in all material respects and nothing has occurred, whether by action or by failure to act, which would cause the loss of such qualification.",erisa
"ERISA. (i) An ERISA Event occurs with respect to a Pension Plan or Multiemployer Plan which has resulted or could reasonably be expected to result in liability of any Loan Party under Title IV of ERISA to the Pension Plan, Multiemployer Plan or the PBGC in an aggregate amount in excess of $5,000,000 or which would reasonably likely result in a Material Adverse Effect, or (ii) a Loan Party or any ERISA Affiliate fails to pay when due, after the expiration of any applicable grace period, any installment payment with respect to its withdrawal liability under Section 4201 of ERISA under a Multiemployer Plan in an aggregate amount in excess of $5,000,000 or which would reasonably likely result in a Material Adverse Effect; or",erisa
"ERISA. No ERISA Event has occurred or is reasonably expected to occur that, when taken together with all other such ERISA Events for which liability is reasonably expected to occur, could reasonably be expected to result in a Material Adverse Effect. The present value of all accumulated benefit obligations under each Plan (based on the assumptions used for purposes of Statement of Financial Standards No. 87) did not, as of the date of the most recent financial statements reflecting such amounts, exceed the fair market value of the assets of such Plan, and the present value of all accumulated benefit obligations of all underfunded Plans (based on the assumptions used for purposes of Statement of Financial Standards No. 87) did not, as of the date of the most recent financial statements reflecting such amounts, exceed the fair market value of the assets of all such underfunded Plans.",erisa
"ERISA. No liability to the Pension Benefit Guaranty Corporation has been incurred with respect to any Plan by the Company or any of its Subsidiaries which has had or would have a Material Adverse Effect. No “prohibited transaction” (as defined in Section 406 of ERISA or Section 4975 of the Code) or “accumulated funding deficiency” (as defined in Section 203 of ERISA) or any of the events set forth in Section 4043(b) of ERISA has occurred with respect to any Plan which has had or would have a Material Adverse Effect, and the execution and delivery of this Agreement and the issuance and sale of the Shares hereunder shall not result in any of the foregoing events. Each Plan is in compliance in all material respects with applicable law, including ERISA and the Code; the Company has not incurred and does not expect to incur liability under Title IV of ERISA with respect to the termination of, or withdrawal from, any Plan; and each Plan for which the Company would have any liability that is intended to be qualified under Section 401(a) of the Code is so qualified in all material respects and nothing has occurred, whether by action or failure to act, which would cause the loss of such qualifications. As used in this Section 4.22, the term “Plan” shall mean an “employee pension benefit plan” (as defined in Section 3 of ERISA) which is or has been established or maintained, or to which contributions are or have been made, by the Company or any Subsidiary or by any trade or business, whether or not incorporated, which, together with the Company or any Subsidiary, is under common control, as described in Section 414(b) or (c) of the Code.",erisa
"ERISA. The occurrence of any of the following events or conditions if any of the same would be reasonably expected to result in a liability of an amount greater than or equal to $20,000,000: (A) any “accumulated funding deficiency,” as such term is defined in Section 302 of ERISA and Section 412 of the Code, whether or not waived, shall exist with respect to any Plan, or any lien shall arise on the assets of the Borrower or any ERISA Affiliate in favor of the PBGC or a Plan; (B) a Termination Event shall occur with respect to a Single Employer Plan, which is, in the reasonable opinion of the Administrative Agent, likely to result in the termination of such Plan for purposes of Title IV of ERISA; (C) a Termination Event shall occur with respect to a Multiemployer Plan or Multiple Employer Plan, which is, in the reasonable opinion of the Administrative Agent, likely to result in (i) the termination of such Plan for purposes of Title IV of ERISA, or (ii) the Borrower or any ERISA Affiliate incurring any liability in connection with a withdrawal from, reorganization of (within the meaning of Section 4241 of ERISA), or insolvency (within the meaning of Section 4245 of ERISA) of such Plan; or (D) any prohibited transaction (within the meaning of Section 406 of ERISA or Section 4975 of the Code) or breach of fiduciary responsibility shall occur which would be reasonably expected to subject the Borrower or any ERISA Affiliate to any liability under Sections 406, 409, 502(i), or 502(l) of ERISA or Section 4975 of the Code, or under any agreement or other instrument pursuant to which the Borrower or any ERISA Affiliate has agreed or is required to indemnify any person against any such liability.",erisa
"ERISA. (i) Promptly upon becoming aware of the occurrence of or forthcoming occurrence of any ERISA Event, a written notice specifying the nature thereof, what action Company, any of its Subsidiaries or any of their respective ERISA Affiliates has taken, is taking or proposes to take with respect thereto and, when known, any action taken or threatened by the Internal Revenue Service, the Department of Labor or the PBGC with respect thereto; and (ii) with reasonable promptness, copies of (1) each Schedule B (Actuarial Information) to the annual report (Form 5500 Series) filed by Company, any of its Subsidiaries or any of their respective ERISA Affiliates with the Internal Revenue Service with respect to each Pension Plan; (2) all notices received by Company, any of its Subsidiaries or any of their respective ERISA Affiliates from a Multiemployer Plan sponsor concerning an ERISA Event; and (3) copies of such other documents or governmental reports or filings relating to any Employee Benefit Plan as Administrative Agent shall reasonably request;",erisa
"ERISA. Each member of the ERISA Group is in compliance with its obligations under the minimum funding standards of ERISA and the Internal Revenue Code with respect to each Plan and is in compliance with the presently applicable provisions of ERISA and the Internal Revenue Code with respect to each Plan, except in each case for noncompliances which could not reasonably be expected to have a Material Adverse Effect. As of the Agreement Date, no member of the ERISA Group has (i) sought a waiver of the minimum funding standard under Section 412 of the Internal Revenue Code in respect of any Plan, (ii) failed to make any contribution or payment to any Plan or Multiemployer Plan or in respect of any Benefit Arrangement, or made any amendment to any Plan or Benefit Arrangement, which has resulted or could result in the imposition of a Lien or the posting of a bond or other security under ERISA or the Internal Revenue Code or (iii) incurred any liability under Title IV of ERISA other than a liability to the PBGC for premiums under Section 4007 of ERISA.",erisa
"ERISA. The Borrower shall, and shall cause each Subsidiary to, promptly pay and discharge all obligations and liabilities arising under ERISA of a character which if unpaid or unperformed could reasonably be expected to result in the imposition of a Lien against any of its Property. The Borrower shall, and shall cause each Subsidiary to, promptly notify the Administrative Agent and each Lender of: (a) the occurrence of any reportable event (as defined in ERISA) with respect to a Plan, (b) receipt of any notice from the PBGC of its intention to seek termination of any Plan or appointment of a trustee therefor, (c) its intention to terminate or withdraw from any Plan, and (d) the occurrence of any event with respect to any Plan which would result in the incurrence by the Borrower or any Subsidiary of any material liability, fine or penalty, or any material increase in the contingent liability of the Borrower or any Subsidiary with respect to any post-retirement Welfare Plan benefit.",erisa
"ERISA. The Unfunded Liabilities of all Single Employer Plans do not in the aggregate exceed $1,000,000. Neither the Borrower nor any other member of the Controlled Group has incurred, or is reasonably expected to incur, any withdrawal liability to Multiemployer Plans in excess of $250,000 in the aggregate. Each Plan complies in all material respects with all applicable requirements of law and regulations, no Reportable Event has occurred with respect to any Plan, neither the Borrower nor any other members of the Controlled Group has withdrawn from any Plan or initiated steps to do so, and no steps have been taken to reorganize or terminate any Plan.",erisa
"ERISA. No Benefit Plan has incurred any accumulated funding deficiency (as defined in Sections 302(a)(2) of ERISA and 412(a) of the Code) whether or not waived. Neither Brightpoint nor any member of the Controlled Group has incurred any liability to the PBGC which remains outstanding other than the payment of premiums, and there are no premium payments which have become due which are unpaid. Schedule B to the most recent annual report filed with the IRS with respect to each Benefit Plan and furnished to the lenders is complete and accurate. Since the date of each such Schedule B, there has been no material adverse change in the funding status or financial condition of the Benefit Plan relating to such Schedule B. Neither Brightpoint nor any member of the Controlled Group has (i) failed to make a required contribution or payment to a Multiemployer Plan or (ii) made a complete or partial withdrawal under Sections 4203 or 4205 of ERISA from a Multiemployer Plan. Neither Brightpoint nor any member of the Controlled Group has failed to make a required installment or any other required payment under Section 412 of the Code on or before the due date for such installment or other payment. Neither Brightpoint nor any member of the Controlled Group is required to provide security to a Benefit Plan under Section 401(a)(29) of the Code due to a Plan amendment that results in an increase in current liability for the plan year. Neither Brightpoint nor any of its Subsidiaries maintains or contributes to any employee welfare benefit plan within the meaning of Section 3(1) of ERISA which provides benefits to employees after termination of employment other than as required by Section 601 of ERISA. Each Plan which is intended to be qualified under Section 401(a) of the Code as currently in effect is so qualified, and each trust related to any such Plan is exempt from federal income tax under Section 501(a) of the Code as currently in effect. Brightpoint and all Subsidiaries are in compliance in all material respects with the responsibilities, obligations and duties imposed on them by ERISA and the Code with respect to all Plans. Neither Brightpoint nor any of its Subsidiaries nor any fiduciary of any Plan has engaged in a nonexempt prohibited transaction described in Sections 406 of ERISA or 4975 of the Code which could reasonably be expected to subject Brightpoint to liability individually or in the aggregate in excess of $250,000. Neither Brightpoint nor any member of the Control...",erisa
"ERISA. (i) An ERISA Event occurs with respect to a Pension Plan or Multiemployer Plan which has resulted or could reasonably be expected to result in liability of any Loan Party under Title IV of ERISA in an aggregate amount which could reasonably be expected to result in a Material Adverse Effect, or (ii) any Loan Party or any ERISA Affiliate fails to pay when due, after the expiration of any applicable grace period, any installment payment with respect to its withdrawal liability under Section 4201 of ERISA under a Multiemployer Plan in an aggregate amount which could reasonably be expected to result in a Material Adverse Effect; or",erisa
"ERISA. (a) Any Plan shall fail to satisfy the minimum funding standard required for any plan year or part thereof under Section 412 of the Code or Section 302 of ERISA or a waiver of such standard or extension of any amortization period is sought or granted under Section 412 or 430 of the Code or Section 302 or 303 of ERISA, a Reportable Event shall have occurred, a contributing sponsor (as defined in Section 4001(a)(13) of ERISA) of a Plan subject to Title IV of ERISA shall be subject to the advance reporting requirement of PBGC Regulation Section 4043.61 (without regard to subparagraph (b)(1) thereof) and an event described in subsection .62, .63, .64, .65, .66, .67 or .68 of PBGC Regulation Section 4043 shall be reasonably expected to occur with respect to such Plan within the following 30 days, any Plan which is subject to Title IV of ERISA shall have had or is reasonably likely to have a trustee appointed to administer such Plan, any Plan which is subject to Title IV of ERISA is, shall have been or is reasonably likely to be terminated or to be the subject of termination proceedings under ERISA, any Plan shall have an Unfunded Current Liability, its actuary has certified that a determination has been made that a Plan (other than a Multiemployer Plan) is an at-risk plan within the meaning of Section 430 of the Code or Section 303 of ERISA, a Plan which is a Multiemployer Plan is in endangered or critical status under Section 305 of ERISA, a contribution required to be made with respect to a Plan or a Foreign Pension Plan is not timely made, the Parent or any of its Subsidiaries or any ERISA Affiliate has incurred or events have happened, or reasonably expected to happen, that will cause it to incur any liability to or on account of a Plan under Section 409, 502(i), 502(l), 515, 4062, 4063, 4064, 4069, 4201, 4204 or 4212 of ERISA or Section 436(f), 4971 or 4975 of the Code or on account of a group health plan (as defined in Section 607(1) of ERISA or Section 4980B(g)(2) of the Code) under Section 4980B of the Code, or the Parent, or any of its Subsidiaries, has incurred or is reasonably likely to incur liabilities pursuant to one or more employee welfare benefit plans (as defined in Section 3(1) of ERISA) that provide benefits to retired employees or other former employees (other than as required by Section 601 of ERISA) or Plans or Foreign Pension Plans; (b) there shall result from any such event or events the imposition of a lien, the granting of a security ...",erisa
"ERISA. Borrower is in compliance in all material respects with all applicable provisions of the Employee Retirement Income Security Act of 1974, as amended or recodified from time to time (""ERISA""); Borrower has not violated any provision of any defined employee pension benefit plan (as defined in ERISA) maintained or contributed to by Borrower (each, a ""Plan""); no Reportable Event as defined in ERISA has occurred and is continuing with respect to any Plan initiated by Borrower; Borrower has met its minimum funding requirements under ERISA with respect to each Plan; and each Plan will be able to fulfill its benefit obligations as they come due in accordance with the Plan documents and under generally accepted accounting principles.",erisa
"ERISA. Neither a Reportable Event nor an “accumulated funding deficiency” (within the meaning of Section 412 of the Code or Section 302 of ERISA) has occurred during the five-year period prior to the date on which this representation is made or deemed made with respect to any Plan, and, to the knowledge and belief of the Credit Parties, each Plan has complied in all material respects with the applicable provisions of ERISA and the Code except where non-compliance, either singly or in the aggregate, could not reasonably be expected to have a Material Adverse Effect. No termination of a Single Employer Plan has occurred, and no Lien in favor of the PBGC or a Plan has arisen, during such five-year period. The present value of all accrued benefits under each Single Employer Plan (based on those assumptions used to fund such Plans) did not, as of the last annual valuation date prior to the date on which this representation is made or deemed made, exceed the value of the assets of such Plan allocable to such accrued benefits by an amount that could reasonably be expected to have a Material Adverse Effect. Neither Credit Party nor any Commonly Controlled Entity has had a complete or partial withdrawal from any Multiemployer Plan that has resulted or could reasonably be expected to result in a liability or loss under ERISA, and neither Credit Party nor any Commonly Controlled Entity would become subject to any liability or loss under ERISA if such Credit Party or any such Commonly Controlled Entity were to withdraw completely from all Multiemployer Plans as of the valuation date most closely preceding the date on which this representation is made or deemed made, in any case where, either singly or in the aggregate, the aggregate amount of loss or liability could not reasonably be expected to have a Material Adverse Effect.",erisa
